title,url,discount,actual
Natural Mosquito Balm Repellent Relief of itchy Skin & Muscle Pain 13g HHI-566655,natural-mosquito-balm-repellent-relief-of-itchy-skin-muscle-pain-13g-p-181713.html,$2.11,$2.75 
3W LED COB Flashlight 160LM 2 Modes Flashlights & Torches HLT-520950,3w-led-cob-flashlight-160lm-2-modes-flashlights-torches-p-162097.html,$2.86,$4.14 
550ML Portable Candy Color Sports Soda Bottle Unbreakable Plastic Water Bottle HHI-551219,550ml-portable-candy-color-sports-soda-bottle-unbreakable-plastic-water-bottle-p-175706.html,$3.12,$4.97 
Vintage Skeleton Coffin Brooch Creative Life Was OK Pins Set Skull Punk Style HHI-558145,vintage-skeleton-coffin-brooch-creative-life-was-ok-pins-set-skull-punk-style-p-177652.html,$1.61,$2.10 
SanDisk A1 16GB UHS-I / Class 10 up to 98MB / s Micro SDHC Memory Card EFM-530160,sandisk-a1-16gb-uhs-i-class-10-up-to-98mb-s-micro-sdhc-memory-card-p-165913.html,$4.71,$6.48 
ESCAM PVR006 USB Webcam Full HD 1080P With Noise Cancellation Microphone HHIHE-581909,escam-pvr006-usb-webcam-full-hd-1080p-with-noise-cancellation-microphone-p-200830.html,$29.82,$53.68 
PVC Waterproof Self Adhesive Sealing Strip 3.2m x 22cm EDT-555017,pvc-waterproof-self-adhesive-sealing-strip-32m-x-22cm-p-176780.html,$6.56,$9.83 
Dual Charging Dock + 2 Batteries for Nintendo Wii GWIICS02,dual-charging-dock-2-batteries-for-nintendo-wii-p-1559.html,$10.12,$12.15 
2.4GHz Wireless 1200 DPI Optical Mouse Mice w/ USB 2.0 Receiver ECAMS-394207,24ghz-wireless-1200-dpi-optical-mouse-mice-w-usb-20-receiver-p-149611.html,$2.88,$6.58 
2pcs DC 12V 36mm Festoon 3W 6-5630 SMD LED Car Reading Lamp RLT-301792,2pcs-dc-12v-36mm-festoon-3w-6-5630-smd-led-car-reading-lamp-p-126764.html,$1.91,$2.05 
2PCS 3R-060 Adjustable Angle Rearview Anti-Blind Spot Mirror RTH-400323,2pcs-3r-060-adjustable-angle-rearview-anti-blind-spot-mirror-p-150806.html,$4.88,$8.77 
2pcs Stainless Steel Rod Magic Stick Metal Rust Remover HKI-508000,2pcs-stainless-steel-rod-magic-stick-metal-rust-remover-p-158517.html,$2.06,$3.71 
1/5/10/20 pcs Bone-shaped Pet Dog Puppy Waste Garbage Bags Dispenser HHI-524872,151020-pcs-bone-shaped-pet-dog-puppy-waste-garbage-bags-dispenser-p-163886.html,$1.75,$2.10 
Sleep Blackout Goggles 3D Eye-Patch Fatigue Mitigation Breathable Nerves Goggles HHI-548249,sleep-blackout-goggles-3d-eye-patch-fatigue-mitigation-breathable-nerves-goggles-p-174279.html,$1.86,$2.41 
SAMSUNG 64GB EVO Class 10 MicroSDXC UHS-3 4K up to 100MB / s Memory Card EFM-353381,samsung-64gb-evo-class-10-microsdxc-uhs-3-4k-up-to-100mb-s-memory-card-p-139832.html,$13.89,$16.66 
Anti-cut Level 5 Cut Resistant Gloves HPPE Safety Work Home Kitchen Garden RTH-572833,anti-cut-level-5-cut-resistant-gloves-hppe-safety-work-home-kitchen-garden-p-182671.html,$3.79,$4.80 
Digital Probe Cooking Food Temperature Sensor BBQ Kitchen LCD Display SCH-513318,digital-probe-cooking-food-temperature-sensor-bbq-kitchen-lcd-display-p-159217.html,$3.48,$4.17 
48-LED Outdoor Motion Sensor Solar Lights EDT-558383,48-led-outdoor-motion-sensor-solar-lights-p-180122.html,$15.75,$24.04 
4-Way Tactical Waist Pack Molle Fishing Gear Bag EDT-564174,4-way-tactical-waist-pack-molle-fishing-gear-bag-p-180272.html,$15.87,$20.63 
Mini Car Auto Waste Trash Rubbish Bin Can Garbage Dust Case Holder HHI-545338,mini-car-auto-waste-trash-rubbish-bin-can-garbage-dust-case-holder-p-173530.html,$5.78,$10.60 
Fingertip Induction Magic Magnetic Ball Decompression Toy TDS-552681,fingertip-induction-magic-magnetic-ball-decompression-toy-p-176156.html,$4.25,$7.64 
Reusable Remover Mesh Cleaning Bags Magic Floating Washing Machine Filter HHI-552215,reusable-remover-mesh-cleaning-bags-magic-floating-washing-machine-filter-p-176098.html,$1.95,$3.51 
E27 Infrared PIR Motion Sensor Light Bulb Switch Holder Converter HLT-512016,e27-infrared-pir-motion-sensor-light-bulb-switch-holder-converter-p-159017.html,$6.33,$12.23 
Felt Car Backseat Organizers Auto Seat Back Storage Bag Tissue Water Bottle Bags RTH-534108,felt-car-backseat-organizers-auto-seat-back-storage-bag-tissue-water-bottle-bags-p-170145.html,$7.32,$9.26 
T29 Bluetooth 3.0 Wireless Vertical Mouse Ergonomic Optical Mouse 6 Buttons RTH-573701,t29-bluetooth-30-wireless-vertical-mouse-ergonomic-optical-mouse-6-buttons-p-182826.html,$11.83,$15.38 
5-IN-1 PENTALOBE SCREWDRIVER SET NLC-557871,5-in-1-pentalobe-screwdriver-set-p-178338.html,$2.15,$3.23 
60X Zoom Universal Mobile Phone Microscope with UV Currency Detector STS-362437,60x-zoom-universal-mobile-phone-microscope-with-uv-currency-detector-p-142683.html,$4.65,$8.37 
12L Multifunctional Travel Fishing Folding Bucket Portable Picnic Storage Campin RTH-577588,12l-multifunctional-travel-fishing-folding-bucket-portable-picnic-storage-campin-p-201499.html,$18.19,$24.55 
M2 New Silicone Bracelet Electronic Digital LED Sport Wrist Watch WTH-560537,m2-new-silicone-bracelet-electronic-digital-led-sport-wrist-watch--p-178709.html,$1.65,$2.15 
Men's Slimming Vest Sweat Sauna Vest Waist Trainer Shapewear RTH-575257,mens-slimming-vest-sweat-sauna-vest-waist-trainer-shapewear-p-182882.html,$14.26,$25.67 
Luxury Mens Watches Waterproof Business Watches DJA-565674,luxury-mens-watches-waterproof-business-watches-p-181062.html,$10.30,$13.39 
HM 1000 Bluetooth V4.1 In-Ear Stealth Earphone with MIC EEP-562613,hm-1000-bluetooth-v41-in-ear-stealth-earphone-with-mic-p-180494.html,$4.79,$8.18 
64GB Class 10 Micro SD Card with Card Adapter EFM-558757,64gb-class-10-micro-sd-card-with-card-adapter-p-177917.html,$7.10,$12.69 
Baellerry D3206 PU Men Wallet Short Purse Coin Pocket Vintage Card Holder RTH-571841,baellerry-d3206-pu-men-wallet-short-purse-coin-pocket-vintage-card-holder-p-182796.html,$7.61,$9.89 
5500dpi Optical USB Wired LED Gaming Mouse DPI Adjustable ECAMS-496127,5500dpi-optical-usb-wired-led-gaming-mouse-dpi-adjustable-p-157466.html,$7.60,$15.20 
Magic Anti-slip Dash Mat Dashboard Sticky Pad Mat Car Adhesive Mat RTH-521128,magic-anti-slip-dash-mat-dashboard-sticky-pad-mat-car-adhesive-mat-p-162198.html,$1.88,$2.44 
2pcs ROCKBROS Bicycle Silica Gel MTB Handlebar Grips SBK-553919,2pcs-rockbros-bicycle-silica-gel-mtb-handlebar-grips-p-176603.html,$2.79,$3.62 
Portable Solar Car Air Purifier Vehicle Home No Noise Filter Cleaner RAF-580794,portable-solar-car-air-purifier-vehicle-home-no-noise-filter-cleaner-p-201249.html,$39.70,$73.44 
2Pcs T10 12V LED SMD 5050 Auto Car RGB LED Interior Light with Remote Control RLT-544760,2pcs-t10-12v-led-smd-5050-auto-car-rgb-led-interior-light-with-remote-control-p-173507.html,$2.93,$5.27 
LCD Digital Display Tread Depth Gauge Digital Vernier Caliper Switch Automatic NLC-558025,lcd-digital-display-tread-depth-gauge-digital-vernier-caliper-switch-automatic-p-180007.html,$3.53,$7.63 
UV Protection Cooling Arm Sleeves with Hand Cover for Men & Women S-552021,uv-protection-cooling-arm-sleeves-with-hand-cover-for-men-women-p-176084.html,$1.83,$3.30 
Men Anti Theft Chest Bag Shoulder Crossbody Bag School Summer Trip Bag A Left RTH-577512,men-anti-theft-chest-bag-shoulder-crossbody-bag-school-summer-trip-bag-a-left-p-200759.html,$12.37,$14.85 
Honeycomb Silicone Replacement Wrist Strap Change Belt for Xiaomi Mi Band 3 / 4 E-573041,honeycomb-silicone-replacement-wrist-strap-change-belt-for-xiaomi-mi-band-3-4-p-182558.html,$2.34,$4.20 
Soldering Iron Kit 60W 110V Adjustable Temperature Welding Soldering Iron EDT-543140,soldering-iron-kit-60w-110v-adjustable-temperature-welding-soldering-iron-p-172804.html,$13.74,$17.86 
V1 Mini Panorama HD Action Camera 220 Degrees FOV 4K 30fps EVC-522449,v1-mini-panorama-hd-action-camera-220-degrees-fov-4k-30fps-p-162761.html,$28.42,$95.53 
9-in-1 Adhesive Jewelry Display Hanging Earring Necklace Ring Hanger Holder HHI-549535,9-in-1-adhesive-jewelry-display-hanging-earring-necklace-ring-hanger-holder-p-174906.html,$3.62,$6.51 
HONGBIAO SM Stereo Bass Earphone Headphones Metal Handsfree Headset 3.5mm EEP-559676,hongbiao-sm-stereo-bass-earphone-headphones-metal-handsfree-headset-35mm-p-178230.html,$2.98,$5.63 
Knitted Cotton Hat Bluetooth Wireless Music Speaker Handfree Headphone EEP-522346,knitted-cotton-hat-bluetooth-wireless-music-speaker-handfree-headphone-p-162711.html,$4.89,$12.20 
ESCAM Shark QP180 960P 360-Degree Security HD VR Wifi Network Camera ECM-522352,escam-shark-qp180-960p-360-degree-security-hd-vr-wifi-network-camera-p-162871.html,$26.70,$79.41 
Waterproof cover Wireless Doorbell ring 300M Remote home smart Door Bell SDB-555205,waterproof-cover-wireless-doorbell-ring-300m-remote-home-smart-door-bell-p-177308.html,$16.72,$20.06 
10pcs LED Light-up Balloon Light LED Inflatable Balloon Lamp TDS-466939,10pcs-led-light-up-balloon-light-led-inflatable-balloon-lamp-p-156244.html,$3.38,$4.40 
DR.BEI Electric Toothbrush Sonic Rechargeable Waterproof Doctor B Dental Brush HHI-583441,drbei-electric-toothbrush-sonic-rechargeable-waterproof-doctor-b-dental-brush-p-201239.html,$38.65,$50.25 
4pcs 1/4 Hex Shank Countersink Drill Bit Set for Woodworking Cutter HHI-532314,4pcs-14-hex-shank-countersink-drill-bit-set-for-woodworking-cutter-p-166596.html,$3.18,$4.83 
S668 Children Smart Watch IP54 Waterproof IPS Round Screen Android Wristwatch E-530127,s668-children-smart-watch-ip54-waterproof-ips-round-screen-android-wristwatch-p-165751.html,$11.41,$84.55 
Xiaomi Pizza Cutter Stainless Steel Cake Knife Pizza Wheels knife Removable HKI-583898,xiaomi-pizza-cutter-stainless-steel-cake-knife-pizza-wheels-knife-removable-p-201632.html,$12.53,$20.05 
Universal G30 HIFI Bluetooth Car Audio Power Amplifier FM Radio Player RTH-583651,universal-g30-hifi-bluetooth-car-audio-power-amplifier-fm-radio-player-p-201629.html,$31.79,$38.14 
Joinrun S19 Bluetooth Speaker Column Wireless Portable Sound Box HHIHE-576709,joinrun-s19-bluetooth-speaker-column-wireless-portable-sound-box-p-201508.html,$30.25,$51.42 
BASEUS Brand 9 in 1 Multi-Country Plugs EU AU UK US Dual USB Travel Charger RTH-574611,baseus-brand-9-in-1-multi-country-plugs-eu-au-uk-us-dual-usb-travel-charger-p-201496.html,$13.91,$27.13 
Dash Cam Hardwire Kit - Mini USB RTH-562749,dash-cam-hardwire-kit-mini-usb-p-180419.html,$4.56,$5.78 
Diving Mask Full Face Snorkeling Mask Swim Training Scuba Mask for Gopro Camera EPAHD-542051,diving-mask-full-face-snorkeling-mask-swim-training-scuba-mask-for-gopro-camera-p-172455.html,$27.51,$33.01 
SKMEI Fashion Simple Women Watches Luxury Brand Quartz Watch Waterproof WWT-576077,skmei-fashion-simple-women-watches-luxury-brand-quartz-watch-waterproof-p-201328.html,$6.30,$9.76 
Xiaomi Sothing Sunny Smart Sensor Night Light Infrared Induction USB Charging RTH-572860,xiaomi-sothing-sunny-smart-sensor-night-light-infrared-induction-usb-charging-p-182670.html,$17.66,$21.19 
Foldable Backpack Packable Daypack for Outdoor Travel Sports Climbing Camping HHI-541129,foldable-backpack-packable-daypack-for-outdoor-travel-sports-climbing-camping-p-171883.html,$5.44,$6.52 
Anion Energy Ball Filter Shower Head High Pressure Water Saving Showerhead HKI-550589,anion-energy-ball-filter-shower-head-high-pressure-water-saving-showerhead-p-175352.html,$10.44,$12.53 
1M 6 LED 7mm Lens IP67 USB Endoscope f Android Smartphone and PC EPA-501953,1m-6-led-7mm-lens-ip67-usb-endoscope-f-android-smartphone-and-pc-p-157982.html,$8.05,$10.47 
40 pcs Sugar Bowl Stickers Black Board DIY Kitchen Jam Jar Labels Stickers HHI-547083,40-pcs-sugar-bowl-stickers-black-board-diy-kitchen-jam-jar-labels-stickers-p-174166.html,$2.34,$2.81 
Adjustable Electric Soldering Iron Band Switch Cross Electric Soldering Iron HHIHE-574432,adjustable-electric-soldering-iron-band-switch-cross-electric-soldering-iron-p-201461.html,$4.80,$8.15 
Mini Auto Range Digital Multimeter Tester AC DC Ammeter Voltmeter Voltage Meter RTH-573677,mini-auto-range-digital-multimeter-tester-ac-dc-ammeter-voltmeter-voltage-meter-p-201459.html,$15.00,$27.75 
SJ4000 480P Camera 1.3MP 30M Waterproof Sports Action Camera DV CAR DVR EVATH-559397,sj4000-480p-camera-13mp-30m-waterproof-sports-action-camera-dv-car-dvr-p-178374.html,$11.56,$26.43 
H96 Mini H6 4GB+128GB Android 9.0 TV Box Allwinner H6 Quad Core 6K H.265 Wifi HD E-574029,h96-mini-h6-4gb128gb-android-90-tv-box-allwinner-h6-quad-core-6k-h265-wifi-hd-p-182808.html,$51.38,$75.66 
Facial Skin Care Acne Blackhead Remover Vacuum Suction Pore Clean Machine HHI-557630,facial-skin-care-acne-blackhead-remover-vacuum-suction-pore-clean-machine-p-177745.html,$10.73,$12.87 
Baellerry Men PU Leather Wallet With Zipper Coin Pocket Vintage Male Short Purse RTH-576484,baellerry-men-pu-leather-wallet-with-zipper-coin-pocket-vintage-male-short-purse-p-201595.html,$7.09,$11.35 
Leather Small Female Purse Women Crocodile Pattern Buckle Slim Wallet Women HHI-580666,leather-small-female-purse-women-crocodile-pattern-buckle-slim-wallet-women-p-201471.html,$5.46,$10.65 
Women Backpack Fashion PU Leather Leisure Travel Large Capacity Bag RTH-580129,women-backpack-fashion-pu-leather-leisure-travel-large-capacity-bag-p-201253.html,$18.16,$20.88 
Electric Makeup Brush Cleaning & Drying Sets Tools HHI-545332,electric-makeup-brush-cleaning-drying-sets-tools-p-173551.html,$22.44,$40.39 
Xiaomi Portable Disinfection Water Generator HHI-581268,xiaomi-portable-disinfection-water-generator-p-201222.html,$47.34,$87.57 
Universal Car Air Vent Mount Stand Holder for Cellphone Under 5.7 Inch RTH-486894,universal-car-air-vent-mount-stand-holder-for-cellphone-under-57-inch-p-156711.html,$2.04,$3.67 
12Pcs Slimming Navel Weight Loss Sticker Slim Patch HHI-565560,12pcs-slimming-navel-weight-loss-sticker-slim-patch-p-181276.html,$3.87,$6.96 
T9 47-Key Gaming Keyboard Professional One-Single Hand USB Wired Keyboards ECAKB-582645,t9-47-key-gaming-keyboard-professional-one-single-hand-usb-wired-keyboards-p-200960.html,$19.17,$23.00 
100ML Clear Body Art Bachelorette Shot Glass HKI-549312,100ml-clear-body-art-bachelorette-shot-glass-p-175168.html,$7.60,$9.12 
19-Hole RUSSIAN PELMENI Dumpling Mold HKI-549477,19-hole-russian-pelmeni-dumpling-mold-p-175039.html,$4.90,$5.87 
YWXLight 5V 4W 250-350LM 16-LED SMD 3528 Portable USB Strip Light HLT-517370,ywxlight-5v-4w-250-350lm-16-led-smd-3528-portable-usb-strip-light-p-160576.html,$2.77,$5.27 
Meter Temperature Tester Pen 3 In1 Function Quality Measurement Tool EDT-581138,meter-temperature-tester-pen-3-in1-function-quality-measurement-tool-p-201401.html,$5.67,$6.24 
Electric Soldering Iron Suit Thermostat Electric Iron Set 28 Pieces Thermostat EDT-580832,electric-soldering-iron-suit-thermostat-electric-iron-set-28-pieces-thermostat-p-201398.html,$24.97,$33.71 
Mosquito Killer Lamp USB Electric Photocatalyst Mosquito Repellent Lamp HHIHE-580657,mosquito-killer-lamp-usb-electric-photocatalyst-mosquito-repellent-lamp-p-201396.html,$18.79,$26.31 
Garment Steamer Household Appliances Vertical Steamer with Steam Iron Brushes HHIHE-578598,garment-steamer-household-appliances-vertical-steamer-with-steam-iron-brushes-p-201300.html,$40.35,$76.66 
Xiaomi Mijia Manual Automatic Two Modes Rechargeable Cordless Screwdriver EDT-581112,xiaomi-mijia-manual-automatic-two-modes-rechargeable-cordless-screwdriver-p-201206.html,$38.10,$41.91 
16.8V Electric Drill Cordless Screwdriver Mini Drill Cordless Power Tools RTH-579598,168v-electric-drill-cordless-screwdriver-mini-drill-cordless-power-tools-p-201203.html,$32.34,$35.57 
Mini Car Dashboard Vent Cleaner Tool Keyboard&Air Outlet Armrest Brush RTH-571468,mini-car-dashboard-vent-cleaner-tool-keyboardair-outlet-armrest-brush-p-182253.html,$3.42,$6.15 
Silicone BBQ Basting Grill Baking Oil Honey Wine Sauce Bottle Brush HKI-544936,silicone-bbq-basting-grill-baking-oil-honey-wine-sauce-bottle-brush-p-173757.html,$2.59,$4.66 
Kitchenware Vegetable Knives Magic Shredded Green Onion Cutter Slicer HHI-545699,kitchenware-vegetable-knives-magic-shredded-green-onion-cutter-slicer-p-173526.html,$2.80,$5.04 
Silicone Dish Bowl Cleaning Brush HKI-546644,silicone-dish-bowl-cleaning-brush-p-174437.html,$2.46,$2.95 
Chicken Duck Holder Rack Grill Stand Roasting for BBQ Rib Non Stick Carbon Steel SCH-547573,chicken-duck-holder-rack-grill-stand-roasting-for-bbq-rib-non-stick-carbon-steel-p-174210.html,$6.48,$7.78 
6/12/24 pcs Coasters for Drinks Set of 6 Vinyl Record Retro Music Coasters HHI-546895,61224-pcs-coasters-for-drinks-set-of-6-vinyl-record-retro-music-coasters-p-174051.html,$5.78,$6.93 
2000W Weed Burner Electric Thermal Weeder Hot Air Weed Killer HHI-581555,2000w-weed-burner-electric-thermal-weeder-hot-air-weed-killer-p-201080.html,$46.09,$78.35 
Portable Manual Ceramic Coffee Grinder Washable Mini Manual Hand Coffee HKI-549170,portable-manual-ceramic-coffee-grinder-washable-mini-manual-hand-coffee-p-174928.html,$13.67,$18.04 
Silicone Washing Board Mini Washboard Candy Color Cleaning Laundry Brush HHI-549581,silicone-washing-board-mini-washboard-candy-color-cleaning-laundry-brush-p-175135.html,$2.49,$4.49 
22 x 27cm BBQ Bake Bag Non-Stick Mesh Grilling Bag S-566806,22-x-27cm-bbq-bake-bag-non-stick-mesh-grilling-bag-p-181291.html,$6.94,$8.32 
Stainless Steel Small Quickdraw Carabiner with Locking SCH-314987,stainless-steel-small-quickdraw-carabiner-with-locking-p-129565.html,$1.09,$1.58 
Women Messenger Bags Female Bags Phone Pocket Women Bags Small Bags DTH-581301,women-messenger-bags-female-bags-phone-pocket-women-bags-small-bags-p-201091.html,$12.24,$14.68 
Dacom K6P Mini Smart Wireless Bluetooth Earbuds With Microphone EEP-583262,dacom-k6p-mini-smart-wireless-bluetooth-earbuds-with-microphone-p-201006.html,$9.52,$17.13 
Multifunction Shoes Hanger Windproof Shoes Drying Rack Glove Scarfs Hanger HHI-545832,multifunction-shoes-hanger-windproof-shoes-drying-rack-glove-scarfs-hanger-p-173760.html,$2.93,$5.27 
Ultrasonic Electronic Pest Repeller Killer Insect for Mosquitoes Rat Cockroach HSI-546163,ultrasonic-electronic-pest-repeller-killer-insect-for-mosquitoes-rat-cockroach-p-173689.html,$5.46,$9.44 
Bicycle Burglar Alarm USB Charging Wireless Remote Control Vibration Device RTH-570902,bicycle-burglar-alarm-usb-charging-wireless-remote-control-vibration-device-p-182145.html,$12.34,$15.54 
Door Viewer 200 Degree 16mm Alloy Tamper Home Security Camera Door Peephole HHI-547013,door-viewer-200-degree-16mm-alloy-tamper-home-security-camera-door-peephole-p-174598.html,$3.54,$4.24 
Stainless Steel Ice Cream Scoop Cookie Scoop Melon Baller HKI-538360,stainless-steel-ice-cream-scoop-cookie-scoop-melon-baller-p-170392.html,$6.46,$11.63 
Ozone Generator Machine Fruit & Vegetable Cleaning Machine Detoxification Ozone HHI-581577,ozone-generator-machine-fruit-vegetable-cleaning-machine-detoxification-ozone-p-201100.html,$62.22,$105.78 
DUBERY 103 Polarized Sunglasses Men Driving Shades Male Retro Sun Glasses S-582304,dubery-103-polarized-sunglasses-men-driving-shades-male-retro-sun-glasses-p-200966.html,$5.35,$9.09 
Mini Folding Reading Glasses + Black Case Classic Collection HHI-552401,mini-folding-reading-glasses-black-case-classic-collection-p-176132.html,$5.48,$7.12 
Over Door Straps Hanger 8 Hooks Adjustable Hat Bag Clothes Coat Rack Organizer HHI-549354,over-door-straps-hanger-8-hooks-adjustable-hat-bag-clothes-coat-rack-organizer-p-174901.html,$4.87,$7.79 
Wall Mounted Silicone Toothbrush Holder HHI-549051,wall-mounted-silicone-toothbrush-holder-p-174746.html,$7.12,$10.68 
SwissTek Ultimate All Purpose Power Scrubber Cleaning Kit (3-Piece) RTH-570129,swisstek-ultimate-all-purpose-power-scrubber-cleaning-kit-3-piece-p-181968.html,$10.87,$14.13 
"Starry Night Projector Lamp 30"" USB Cord LED Light Bulbs for Kids Bedroom HLT-550357",starry-night-projector-lamp-30-usb-cord-led-light-bulbs-for-kids-bedroom-p-175322.html,$10.60,$12.01 
Mini Water Smoking Tobacco Pipe Smoking Accessory Cigarette Cigar Holder HKI-560988,mini-water-smoking-tobacco-pipe-smoking-accessory-cigarette-cigar-holder-p-180869.html,$6.98,$8.09 
Waterproof Outdoor Sports Casual Men's Watch Watch Student Quartz Watch WWT-579530,waterproof-outdoor-sports-casual-mens-watch-watch-student-quartz-watch-p-200805.html,$8.60,$15.48 
NAVIFORCE 9164 Men's Watch Dual Display 3ATM Business Sports Wrist Watches RTH-574679,naviforce-9164-mens-watch-dual-display-3atm-business-sports-wrist-watches-p-200804.html,$22.69,$40.84 
Egg Shape Stainless Steel 60-Minute Kitchen Timer Mechanical Drive Cooking Timer HKI-542430,egg-shape-stainless-steel-60-minute-kitchen-timer-mechanical-drive-cooking-timer-p-172445.html,$6.74,$11.69 
Loaf Pan Rectangle Toast Bread Cake Mold Carbon Steel Pastry Baking Bakeware HKI-582595,loaf-pan-rectangle-toast-bread-cake-mold-carbon-steel-pastry-baking-bakeware-p-201020.html,$6.02,$10.84 
Non-Stick Grill BBQ Standing Rib Rack Stainless Steel Roasting Rack HKI-550792,non-stick-grill-bbq-standing-rib-rack-stainless-steel-roasting-rack-p-175485.html,$11.36,$15.11 
Stainless Steel Noodle Maker Lattice Roller Cutter DIY Dough Cutting Tool HKI-552342,stainless-steel-noodle-maker-lattice-roller-cutter-diy-dough-cutting-tool-p-176109.html,$5.55,$9.99 
2pcs Oven Rack Protectors Edge Liner Cover HKI-551319,2pcs-oven-rack-protectors-edge-liner-cover-p-175703.html,$5.20,$9.37 
Dragonfly Millet Mosquito Killer Energy-Saving Mosquito Killer Killer Lamp HHIHE-582744,dragonfly-millet-mosquito-killer-energy-saving-mosquito-killer-killer-lamp-p-200980.html,$19.05,$34.29 
USB Electric Mosquito Repellent Lamp Electric Shock Insect Killer Safe HHI-582655,usb-electric-mosquito-repellent-lamp-electric-shock-insect-killer-safe-p-200951.html,$14.69,$17.62 
1/2/4/6 pcs Universal Air Vent Magnetic Car Mount Mobile Phone Holder Stand RTH-497869,1246-pcs-universal-air-vent-magnetic-car-mount-mobile-phone-holder-stand-p-157697.html,$3.33,$4.00 
Water Shoes Swim Shoes Quick-Dry Aqua Yoga Socks for Women Men S-567690,water-shoes-swim-shoes-quick-dry-aqua-yoga-socks-for-women-men-p-181491.html,$7.09,$14.19 
UV400 Ski Goggles Men Women Anti-fog Adult Winter Skiing Eyewear Snow Goggles S-552245,uv400-ski-goggles-men-women-anti-fog-adult-winter-skiing-eyewear-snow-goggles-p-176080.html,$4.05,$7.28 
Car Tissue Box Sun-shading Board Hanging Tissue Box Holder RTH-438991,car-tissue-box-sun-shading-board-hanging-tissue-box-holder-p-155390.html,$3.06,$3.97 
Spatula Pot Lid Holder Rack HHI-561207,spatula-pot-lid-holder-rack-p-179044.html,$3.62,$4.35 
Motion Sensor 6-LED Night Light for Hallway Bathroom HHI-556231,motion-sensor-6-led-night-light-for-hallway-bathroom-p-177343.html,$3.71,$6.38 
WLISTH Watch Men Trend Of Luminous Waterproof Strip Quartz Watch WWT-582503,wlisth-watch-men-trend-of-luminous-waterproof-strip-quartz-watch-p-200750.html,$13.93,$25.08 
Cross Double Arc Lighter Case USB Pulse Windproof Lighters HHI-553084,cross-double-arc-lighter-case-usb-pulse-windproof-lighters-p-176394.html,$9.31,$16.76 
Transparent ID Card Holder PVC Folding Short Wallet High Grade Women Girl RTH-575785,transparent-id-card-holder-pvc-folding-short-wallet-high-grade-women-girl-p-200877.html,$6.17,$11.10 
DUBERY 1948 Unisex Vintage Sunglasses Polarized Sun Glasses For Men Driving S-580857,dubery-1948-unisex-vintage-sunglasses-polarized-sun-glasses-for-men-driving-p-200873.html,$8.11,$9.73 
C6T Body Temperature Smart Bracelet Watch IP67 Heart Rate Monitor Wristband E-582873,c6t-body-temperature-smart-bracelet-watch-ip67-heart-rate-monitor-wristband-p-200742.html,$16.00,$19.20 
Smart Digital Alarm Clock Large LCD Screen Big Digit Backlit HHI-555143,smart-digital-alarm-clock-large-lcd-screen-big-digit-backlit-p-177255.html,$7.09,$10.84 
"4"" Electric Desktop Halogen Heater Fan HHI-562260",4-electric-desktop-halogen-heater-fan-p-178989.html,$10.64,$13.90 
Screen Window Manual Cleaning Brush HHI-560991,screen-window-manual-cleaning-brush-p-178836.html,$2.67,$4.81 
DIY Necklace Pendant Crystal Silicone Mold Tray HHI-557274,diy-necklace-pendant-crystal-silicone-mold-tray-p-178162.html,$4.73,$5.68 
10pcs Compressed Coin Tissue Towel HHI-549262,10pcs-compressed-coin-tissue-towel-p-175044.html,$1.59,$2.85 
2 PCS Transparent Car Rearview Mirror Rain Water Eyebrow Cover RTH-520994,2-pcs-transparent-car-rearview-mirror-rain-water-eyebrow-cover-p-162139.html,$2.35,$2.82 
Lazy Glasses Horizontal Glasses Lied To Watch TV Books Newspaper Lazy Man RTH-573550,lazy-glasses-horizontal-glasses-lied-to-watch-tv-books-newspaper-lazy-man-p-182734.html,$7.04,$8.44 
Silicon Fishing Lures Luminous Shrimp Lures Soft Lures Artificial Baits S-548588,silicon-fishing-lures-luminous-shrimp-lures-soft-lures-artificial-baits-p-174603.html,$1.41,$1.70 
Luminous 12 Constellations Leather Zodiac Sign Bracelet with Beads Bangle Bracel HHI-557694,luminous-12-constellations-leather-zodiac-sign-bracelet-with-beads-bangle-bracel-p-177738.html,$1.59,$2.07 
UV 400 Retro Round Metal Sunglasses Steampunk Unisex Men Women Brand Classic RTH-573344,uv-400-retro-round-metal-sunglasses-steampunk-unisex-men-women-brand-classic-p-182740.html,$5.47,$7.11 
YIKE Car Phone Air Vent Mount Stand Adjustable Holder for Smartphones RTH-516792,yike-car-phone-air-vent-mount-stand-adjustable-holder-for-smartphones-p-160911.html,$3.45,$4.69 
Usb Microphone For Pc Desktop Notebook Capacitor Wired Microphones EMC-582850,usb-microphone-for-pc-desktop-notebook-capacitor-wired-microphones-p-200778.html,$14.37,$17.24 
DC 12V 22-SMD 1206 LED Car White Light Lamp Roof / Reading Lamp RLT-274934,dc-12v-22-smd-1206-led-car-white-light-lamp-roof-reading-lamp-p-118477.html,$1.54,$2.77 
PANARS Men Sports Watch G Waterproof Digital LEDS Male Shock Military Watch RTH-571251,panars-men-sports-watch-g-waterproof-digital-leds-male-shock-military-watch-p-182200.html,$8.94,$19.89 
L3 Sports Smart Watch iOS Android Heart Rate Monitor 9.9mm Thin E-551277,l3-sports-smart-watch-ios-android-heart-rate-monitor-99mm-thin-p-175681.html,$36.64,$47.64 
