title,url,discount,actual
Authentic Augvape VX217 217W Starter KIT - Black NECM-583569,authentic-augvape-vx217-217w-starter-kit-black-p-201789.html,$53.96,$97.13 
Authentic Augvape Intake Sub-Ohm Tank - Matt Black NECT-583568,authentic-augvape-intake-sub-ohm-tank-matt-black-p-201788.html,$23.40,$42.11 
Authentic Augvape Intake Sub-Ohm Tank - Stainless Steel NECT-583567,authentic-augvape-intake-sub-ohm-tank-stainless-steel-p-201787.html,$19.76,$20.03 
Authentic Innokin Kroma R ZLIDE Starter Kit - Black NECM-583565,authentic-innokin-kroma-r-zlide-starter-kit-black-p-201785.html,$64.81,$116.67 
Authentic Innokin Podin Pod  Starter Kit - Black Marble NECS-583564,authentic-innokin-podin-pod-starter-kit-black-marble-p-201784.html,$34.73,$62.51 
Authentic Innokin Podin Pod  Starter Kit - Black NECS-583563,authentic-innokin-podin-pod-starter-kit-black-p-201783.html,$34.73,$62.51 
Authentic Vaporesso GEN S 220W TC Mod - Midnight Blue NECM-583562,authentic-vaporesso-gen-s-220w-tc-mod-midnight-blue-p-201782.html,$49.08,$88.34 
Authentic Vaporesso GEN S 220W TC Mod - Matte Gray NECM-583561,authentic-vaporesso-gen-s-220w-tc-mod-matte-gray-p-201781.html,$49.08,$88.34 
Authentic Vaporesso GEN S 220W TC Mod - Lime Green NECM-583560,authentic-vaporesso-gen-s-220w-tc-mod-lime-green-p-201777.html,$49.08,$88.34 
Authentic Vaporesso GEN S Kit with NRG-S Mesh Tank - Lime Green NECM-583559,authentic-vaporesso-gen-s-kit-with-nrg-s-mesh-tank-lime-green-p-201773.html,$62.19,$111.95 
Authentic Vaporesso GEN S Kit with NRG-S Tank - Midnight Blue NECM-583558,authentic-vaporesso-gen-s-kit-with-nrg-s-tank-midnight-blue-p-201770.html,$61.76,$111.17 
Authentic Vaporesso GEN S Kit with NRG-S Mesh Tank - Matte Gray NECM-583557,authentic-vaporesso-gen-s-kit-with-nrg-s-mesh-tank-matte-gray-p-201767.html,$61.76,$111.17 
Authentic Geekvape Aegis Boost Plus 40W Pod  Kit - Aura Glow NECS-583556,authentic-geekvape-aegis-boost-plus-40w-pod-kit-aura-glow-p-201764.html,$35.93,$64.67 
Authentic Geekvape Aegis Boost Plus 40W Pod  Kit - Almighty Blue NECS-583555,authentic-geekvape-aegis-boost-plus-40w-pod-kit-almighty-blue-p-201762.html,$35.93,$64.67 
Authentic Geekvape Aegis Boost Plus 40W Pod  Kit - Gunmetal NECS-583553,authentic-geekvape-aegis-boost-plus-40w-pod-kit-gunmetal-p-201760.html,$35.93,$64.67 
Authentic Geekvape Aegis Boost Plus 40W Pod  Kit - Classic Silver NECS-583551,authentic-geekvape-aegis-boost-plus-40w-pod-kit-classic-silver-p-201757.html,$35.93,$64.67 
Authentic Geekvape Aegis Boost Plus 40W Pod  Kit - Space Black NECS-583550,authentic-geekvape-aegis-boost-plus-40w-pod-kit-space-black-p-201755.html,$39.13,$70.44 
Authentic Geekvape Aegis Boost Plus 40W Pod  Kit - Devil Red NECS-583549,authentic-geekvape-aegis-boost-plus-40w-pod-kit-devil-red-p-201752.html,$35.93,$64.67 
Authentic IJOY CAPTAIN 1500 KIT - Green NECS-583548,authentic-ijoy-captain-1500-kit-green-p-201751.html,$26.76,$48.18 
Authentic IJOY CAPTAIN 1500 KIT - Gunmetal NECS-583547,authentic-ijoy-captain-1500-kit-gunmetal-p-201749.html,$26.76,$48.18 
Authentic IJOY CAPTAIN 1500 KIT - Black NECS-583546,authentic-ijoy-captain-1500-kit-black-p-201747.html,$26.76,$48.18 
Authentic IJOY CAPTAIN 1500 KIT - Red NECS-583545,authentic-ijoy-captain-1500-kit-red-p-201745.html,$26.76,$48.18 
Authentic IJOY CAPTAIN 1500 KIT - Blue NECS-583544,authentic-ijoy-captain-1500-kit-blue-p-201743.html,$26.76,$48.18 
Authentic IJOY Captain 2 Mod - Rainbow NECM-583543,authentic-ijoy-captain-2-mod-rainbow-p-201741.html,$45.55,$81.99 
Authentic IJOY Captain 2 Mod - Blue NECM-583542,authentic-ijoy-captain-2-mod-blue-p-201739.html,$50.56,$91.00 
Authentic IJOY Captain 2 Mod - Gunmetal NECM-583540,authentic-ijoy-captain-2-mod-gunmetal-p-201737.html,$50.56,$91.00 
Authentic IJOY CAPTAIN 2 Kit - Rainbow NECM-583538,authentic-ijoy-captain-2-kit-rainbow-p-201735.html,$57.33,$103.20 
Authentic IJOY CAPTAIN 2 Kit - Blue NECM-583537,authentic-ijoy-captain-2-kit-blue-p-201733.html,$57.33,$103.20 
Authentic IJOY CAPTAIN 2 Kit - Red NECM-583536,authentic-ijoy-captain-2-kit-red-p-201731.html,$57.33,$103.20 
Authentic IJOY CAPTAIN 2 Kit - Gunmetal NECM-583535,authentic-ijoy-captain-2-kit-gunmetal-p-201729.html,$57.33,$103.20 
Authentic IJOY CAPTAIN 2 Kit - Black NECM-583534,authentic-ijoy-captain-2-kit-black-p-201727.html,$57.33,$103.20 
Authentic Vaporesso GEN NANO 80W TC Mod 2000mAh - Red NECS-583524,authentic-vaporesso-gen-nano-80w-tc-mod-2000mah-red-p-201725.html,$43.15,$77.67 
Authentic Vaporesso GEN NANO 80W TC Mod 2000mAh - Blue NECS-583523,authentic-vaporesso-gen-nano-80w-tc-mod-2000mah-blue-p-201723.html,$41.67,$75.01 
Authentic Vaporesso GEN NANO 80W TC Mod 2000mAh - Silver NECS-583522,authentic-vaporesso-gen-nano-80w-tc-mod-2000mah-silver-p-201721.html,$41.67,$75.01 
Authentic Vaporesso GEN NANO 80W TC Mod 2000mAh - Black NECS-583521,authentic-vaporesso-gen-nano-80w-tc-mod-2000mah-black-p-201719.html,$43.15,$77.67 
Authentic Vaporesso GTX ONE Box Mod 2000mAh - Red NECS-583520,authentic-vaporesso-gtx-one-box-mod-2000mah-red-p-201717.html,$31.76,$57.17 
Authentic Vaporesso GTX ONE Box Mod 2000mAh - Blue NECS-583519,authentic-vaporesso-gtx-one-box-mod-2000mah-blue-p-201715.html,$30.10,$54.17 
Authentic Vaporesso GTX ONE Box Mod 2000mAh - Silver NECS-583518,authentic-vaporesso-gtx-one-box-mod-2000mah-silver-p-201714.html,$30.47,$54.84 
Authentic Vaporesso GTX ONE Box Mod 2000mAh - Black NECS-583517,authentic-vaporesso-gtx-one-box-mod-2000mah-black-p-201713.html,$31.76,$57.17 
Authentic Vaporesso GEN Nano 80W Kit 2000mAh - Purple NECS-583516,authentic-vaporesso-gen-nano-80w-kit-2000mah-purple-p-201712.html,$52.50,$94.50 
Authentic Vaporesso GEN Nano 80W Kit 2000mAh - Green NECS-583515,authentic-vaporesso-gen-nano-80w-kit-2000mah-green-p-201711.html,$51.76,$93.17 
Authentic Vaporesso GEN Nano 80W Kit 2000mAh - Blue NECS-583514,authentic-vaporesso-gen-nano-80w-kit-2000mah-blue-p-201710.html,$49.45,$89.00 
Authentic Vaporesso GEN Nano 80W Kit 2000mAh - Red NECS-583513,authentic-vaporesso-gen-nano-80w-kit-2000mah-red-p-201709.html,$52.50,$94.50 
Authentic Vaporesso GEN Nano 80W Kit 2000mAh - Silver NECS-583512,authentic-vaporesso-gen-nano-80w-kit-2000mah-silver-p-201708.html,$52.50,$94.50 
Authentic Vaporesso GEN Nano 80W Kit 2000mAh - Black NECS-583511,authentic-vaporesso-gen-nano-80w-kit-2000mah-black-p-201707.html,$52.50,$94.50 
Authentic Vaporesso GTX ONE 40W VW Kit 2000mAh - Blue NECS-583509,authentic-vaporesso-gtx-one-40w-vw-kit-2000mah-blue-p-201705.html,$38.34,$69.01 
Authentic Vaporesso GTX ONE 40W VW Kit 2000mAh - Silver NECS-583508,authentic-vaporesso-gtx-one-40w-vw-kit-2000mah-silver-p-201704.html,$38.52,$69.34 
Authentic Vaporesso GTX ONE 40W VW Kit 2000mAh - Black NECS-583507,authentic-vaporesso-gtx-one-40w-vw-kit-2000mah-black-p-201703.html,$39.48,$71.06 
3 x Authentic SMOK Nfix Replacement Cartridge 3ml Pod 0.8ohm NECEA-583124,3-x-authentic-smok-nfix-replacement-cartridge-3ml-pod-08ohm-p-201702.html,$11.15,$20.07 
Authentic SMOK Nfix 25W VW Pod Kit 700mAh - Black NECS-583121,authentic-smok-nfix-25w-vw-pod-kit-700mah-black-p-201701.html,$27.86,$50.15 
Authentic SMOK Nfix 25W VW Pod Kit 700mAh - Red NECS-583120,authentic-smok-nfix-25w-vw-pod-kit-700mah-red-p-201700.html,$29.91,$53.84 
Authentic SMOK Nfix 25W VW Pod Kit 700mAh - Silver NECS-583116,authentic-smok-nfix-25w-vw-pod-kit-700mah-silver-p-201698.html,$28.43,$51.18 
Authentic SMOK RPM160 Pod Kit Dual-18650 - 7-Color Carbon Fiber NECS-582918,authentic-smok-rpm160-pod-kit-dual-18650-7-color-carbon-fiber-p-201697.html,$36.41,$65.54 
Authentic SMOK RPM160 Pod Kit Dual-18650 - Silver Carbon Fiber NECS-582917,authentic-smok-rpm160-pod-kit-dual-18650-silver-carbon-fiber-p-201696.html,$41.78,$75.21 
Authentic SMOK RPM160 Pod Kit Dual-18650 - Red Carbon Fiber NECS-582916,authentic-smok-rpm160-pod-kit-dual-18650-red-carbon-fiber-p-201695.html,$41.78,$75.21 
Authentic SMOK RPM160 Pod Kit Dual-18650 - Black Carbon Fiber NECS-582915,authentic-smok-rpm160-pod-kit-dual-18650-black-carbon-fiber-p-201694.html,$41.78,$75.21 
LEMFO LEM5 Pro Smart Watch Android 5.1 2GB+16GB SIM Card Cell Phone Smartwatch E-541741,lemfo-lem5-pro-smart-watch-android-51-2gb16gb-sim-card-cell-phone-smartwatch-p-172416.html,$136.56,$177.52 
Pet Dog Cat Toothpaste Dental Care Kit with Dual Toothbrush for Oral Hygiene HPI-539618,pet-dog-cat-toothpaste-dental-care-kit-with-dual-toothbrush-for-oral-hygiene-p-170994.html,$5.49,$9.88 
QI Car Wireless Charger Mobile Phone Navigation Stand HUD Fast Charge Dedicated RTH-550812,qi-car-wireless-charger-mobile-phone-navigation-stand-hud-fast-charge-dedicated-p-175539.html,$18.75,$22.50 
TOPK 1M Round Magnetic LED USB Charging Cable Micro USB Magnet Charger Android EPACB-572766,topk-1m-round-magnetic-led-usb-charging-cable-micro-usb-magnet-charger-android-p-182494.html,$3.55,$4.13 
Colorful Magic Flow Ring Bracelet Kinetic Spring Toy 3D Shaped Sculpture Ring TDS-550704,colorful-magic-flow-ring-bracelet-kinetic-spring-toy-3d-shaped-sculpture-ring-p-175483.html,$5.32,$6.38 
6pcs Stainless Steel Adhesive Wall Hook Door Hanger Towel Hook Kitchen Bathroom HHI-572727,6pcs-stainless-steel-adhesive-wall-hook-door-hanger-towel-hook-kitchen-bathroom-p-182476.html,$1.71,$1.93 
USB Wired Joypad Gamepad Controller for Microsoft Xbox 360 E-524338,usb-wired-joypad-gamepad-controller-for-microsoft-xbox-360-p-163595.html,$16.66,$19.99 
16pcs/set Educational Balance Blocks Toy Cartoon Wooden Toys For Children TDS-551829,16pcsset-educational-balance-blocks-toy-cartoon-wooden-toys-for-children-p-175856.html,$9.92,$11.90 
Pair of Stripe Cotton Socks Slippers Short Ankle Socks HHI-560271,pair-of-stripe-cotton-socks-slippers-short-ankle-socks-p-178609.html,$2.25,$4.05 
Aluminum Alloy Fishing Hook Line Knotter Manual Fishing Hook Strand Knotting SFS-545710,aluminum-alloy-fishing-hook-line-knotter-manual-fishing-hook-strand-knotting-p-173832.html,$2.74,$3.04 
Solar Powered Ground Light Waterproof Garden Pathway Light f/ Yard Driveway Lawn HSI-546157,solar-powered-ground-light-waterproof-garden-pathway-light-f-yard-driveway-lawn-p-173678.html,$5.53,$8.44 
YWXLIGHT E27 5W Bluetooth LED App Controlled Light Bulb Dimmable Globe Bulb HLT-538072,ywxlight-e27-5w-bluetooth-led-app-controlled-light-bulb-dimmable-globe-bulb-p-170945.html,$10.43,$19.62 
Mini Car Emergency Rescue Hammer Tool Safety Escape Hammer Window Glass Breaker RKC-545053,mini-car-emergency-rescue-hammer-tool-safety-escape-hammer-window-glass-breaker-p-173653.html,$2.93,$3.81 
1.5m Yoga Pilates Stretch Resistance Band Exercise Elastic Fitness Band STH-547484,15m-yoga-pilates-stretch-resistance-band-exercise-elastic-fitness-band-p-174288.html,$3.17,$3.80 
Floating Fishing Gripper Fish Lip Grip Pliers Grabber Keeper Holder SFS-546363,floating-fishing-gripper-fish-lip-grip-pliers-grabber-keeper-holder-p-174117.html,$3.08,$5.33 
Simulative Crabs Style 3D False Bait Road Bait 10cm Not Hook SFS-546354,simulative-crabs-style-3d-false-bait-road-bait-10cm-not-hook-p-174035.html,$3.01,$3.61 
LED lamp light pen ballpoint pen with light multifunctional flashlight at night HHI-556445,led-lamp-light-pen-ballpoint-pen-with-light-multifunctional-flashlight-at-night-p-177534.html,$1.34,$1.61 
2 in 1 Pet Shower Head Sprayer Bath Massage Brush Pet Dog Wash Massage Brush HPI-542764,2-in-1-pet-shower-head-sprayer-bath-massage-brush-pet-dog-wash-massage-brush-p-172452.html,$12.02,$21.63 
5Gbps 4-Port USB 3.0 Hub for Laptop EDT-559326,5gbps-4-port-usb-30-hub-for-laptop-p-178594.html,$7.99,$14.38 
5M Car Interior Moulding Strips Decoration Line Car-styling Auto Accessories RST-549023,5m-car-interior-moulding-strips-decoration-line-car-styling-auto-accessories-p-174847.html,$4.58,$5.96 
"Gamesir X1 Battledock Converter Stand Docking For PUBG, FPS Games EGC-547420",gamesir-x1-battledock-converter-stand-docking-for-pubg-fps-games-p-175224.html,$40.67,$48.80 
Adjustable Dog Leash Coupler Two Way Pet Elastic Traction Rope 2.0*50cm HPI-543941,adjustable-dog-leash-coupler-two-way-pet-elastic-traction-rope-2050cm-p-173143.html,$5.16,$6.19 
3 LEDs Outdoor Camping Tent Hanging Lamp Garden Bulb LED Light HLT-548766,3-leds-outdoor-camping-tent-hanging-lamp-garden-bulb-led-light-p-174896.html,$3.11,$5.59 
Xiaomi Wired Foldable Type Stereo 3.5mm Headset Headphone EEP-381489,xiaomi-wired-foldable-type-stereo-35mm-headset-headphone-p-147665.html,$117.24,$152.41 
USB Smart Charger 20 Ports USB Hub Fast Charging Station EDT-562948,usb-smart-charger-20-ports-usb-hub-fast-charging-station-p-179363.html,$31.54,$41.01 
KONSMART 25W 5A 6-Ports USB Desktop Charger EDT-561511,konsmart-25w-5a-6-ports-usb-desktop-charger-p-179047.html,$8.16,$10.61 
WLtoys A959 High-Speed Vortex 4-CH 1:18 2.4GHz 4WD RC Car TRC-304354,wltoys-a959-high-speed-vortex-4-ch-118-24ghz-4wd-rc-car-p-127852.html,$76.23,$111.08 
S Size Portable Dog Paw Clean Cup HPI-554645,s-size-portable-dog-paw-clean-cup-p-176672.html,$7.72,$9.26 
220V MR16 (GU5.3) 4W 400LM 60-LED SMD 3528 LED LED Light Bulbs HLT-318683,220v-mr16-gu53-4w-400lm-60-led-smd-3528-led-led-light-bulbs-p-130907.html,$2.68,$4.04 
Dual USB Charge Dock Stand for Dual Game Microsoft Xbox One Wireless Controller EVG-545445,dual-usb-charge-dock-stand-for-dual-game-microsoft-xbox-one-wireless-controller-p-173839.html,$8.55,$15.39 
E27 9W LED Bulb Bug Zapper Light Bulb Mosquito Killer Bulb Insect Trap Lamp HLT-551356,e27-9w-led-bulb-bug-zapper-light-bulb-mosquito-killer-bulb-insect-trap-lamp-p-175672.html,$4.63,$6.59 
12PCs Car Audio Dashboard Dismantlement Installer Tool Kit RTH-548865,12pcs-car-audio-dashboard-dismantlement-installer-tool-kit-p-175022.html,$12.08,$21.74 
Retro Bluetooth speaker Powerful portable speakers Mini Wireless Speaker Stereo HHITH-583760,retro-bluetooth-speaker-powerful-portable-speakers-mini-wireless-speaker-stereo-p-201654.html,$12.41,$21.72 
Ball Bluetooth Speaker Wireless Mini Speaker Subwoofer FM Multicolored Ball HHITH-583757,ball-bluetooth-speaker-wireless-mini-speaker-subwoofer-fm-multicolored-ball-p-201653.html,$16.44,$27.95 
Mini Portable Home Air Conditioning Humidifier Purifier USB Air Cooler Fan HHIHE-583799,mini-portable-home-air-conditioning-humidifier-purifier-usb-air-cooler-fan-p-201651.html,$28.36,$46.79 
Women Arm Shaper Back Shoulder Corrector Humpback Posture Corrector DUW-584071,women-arm-shaper-back-shoulder-corrector-humpback-posture-corrector-p-201650.html,$10.58,$19.57 
Car Solid Wax Paint Care Protection Scratch Repair Wax Polish Remove Scratches HHI-549204,car-solid-wax-paint-care-protection-scratch-repair-wax-polish-remove-scratches-p-175176.html,$12.00,$14.73 
Kingsons Style Men's Business Backpack Derm Backpack Men's Computer Bag DBA-583720,kingsons-style-mens-business-backpack-derm-backpack-mens-computer-bag-p-201655.html,$40.26,$64.42 
Mini Pump Bike Air Hand Pump Fits Presta & Schrader Valve Portable Tire Pump SBK-544120,mini-pump-bike-air-hand-pump-fits-presta-schrader-valve-portable-tire-pump-p-173305.html,$6.38,$7.66 
LED Solar Charging Flashlight – 3 Light Modes S-563961,led-solar-charging-flashlight-–-3-light-modes-p-180207.html,$13.08,$19.05 
LED Dog Collar Light USB Rechargeable Glowing Dog Collars HPI-562288,led-dog-collar-light-usb-rechargeable-glowing-dog-collars-p-179346.html,$4.65,$8.36 
Sleeping Face Lift Up Belt BBI-564823,sleeping-face-lift-up-belt-p-180170.html,$5.08,$9.14 
Touch Screen Digitizer & LCD Display Test Cable f iPhone 5 MIC-249730,touch-screen-digitizer-lcd-display-test-cable-f-iphone-5-p-110470.html,$2.29,$6.22 
Car Trunk Luggage Net Car Mesh Storage Organizer w 4 Hooks Car Storage Network RTH-541290,car-trunk-luggage-net-car-mesh-storage-organizer-w-4-hooks-car-storage-network-p-171889.html,$6.87,$12.12 
DC 12V 1.5A LED Light Transformer LED Constant Voltage HLT-306257,dc-12v-15a-led-light-transformer-led-constant-voltage-p-127793.html,$4.51,$5.86 
Super Car Wash Glove Car Hand Soft Towel Microfiber Chenille Car Cleaning Sponge RTH-548708,super-car-wash-glove-car-hand-soft-towel-microfiber-chenille-car-cleaning-sponge-p-174724.html,$5.25,$9.44 
Mini Wireless Bluetooth Stereo Audio Optical Aux 3.5mm Transmitter Music Adapter RTH-576733,mini-wireless-bluetooth-stereo-audio-optical-aux-35mm-transmitter-music-adapter-p-201643.html,$11.66,$20.99 
H96-P DLP Amlogic S905 Android 6.0 2G 16G 854x480 TF Card BT 4.0 WiFi Projector E-539224,h96-dlp-amlogic-s905-android-60-2g-16g-854x480-tf-card-bt-40-wifi-projector-p-170878.html,$119.06,$379.79 
X23 Earphone Car Single Ear Can Talk Wireless Bluetooth Headset Hanging RTH-577663,x23-earphone-car-single-ear-can-talk-wireless-bluetooth-headset-hanging-p-201648.html,$6.75,$12.82 
Wireless Bluetooth FM Transmitter Hands-Free Car Kit Color Screen MP3 Player RCG-583803,wireless-bluetooth-fm-transmitter-hands-free-car-kit-color-screen-mp3-player-p-201642.html,$18.11,$19.92 
Printing Pen 12V 3D Pen Pencil 3D Drawing Pen Filament For Kid Education OSN-576911,printing-pen-12v-3d-pen-pencil-3d-drawing-pen-filament-for-kid-education-p-201647.html,$16.06,$24.89 
Core Double AB Roller Wheel Fitness Abdominal Exercises Waist Slimming Trainer STH-550587,core-double-ab-roller-wheel-fitness-abdominal-exercises-waist-slimming-trainer-p-175361.html,$32.69,$58.84 
4pcs Universal 4D Anti Scratch Decal RTH-562710,4pcs-universal-4d-anti-scratch-decal-p-180441.html,$3.06,$3.67 
4 in 1 Car Charger Temperature Display Dual USB Power Adapter For Mobile Phone HHITH-566297,4-in-1-car-charger-temperature-display-dual-usb-power-adapter-for-mobile-phone-p-181497.html,$3.40,$4.08 
Multifunction Metal Tire Inflator Pump With LCD Digital Display EDT-565913,multifunction-metal-tire-inflator-pump-with-lcd-digital-display-p-181437.html,$37.36,$48.56 
Cafele 3.4A Universal Mini Dual USB Fast Charge Car Charger for Cell Phones E-566039,cafele-34a-universal-mini-dual-usb-fast-charge-car-charger-for-cell-phones-p-181136.html,$4.78,$9.75 
MINI Electronic Wireless ABS Fish Bite Alarm Sound Running LED Sensitive Mat S-551572,mini-electronic-wireless-abs-fish-bite-alarm-sound-running-led-sensitive-mat-p-175695.html,$4.08,$4.89 
Waterproof LED Chest Light Night Running + Removable Fixing Band EDT-564104,waterproof-led-chest-light-night-running-removable-fixing-band-p-180287.html,$13.50,$24.30 
SOKI Men Quartz Watch with Date Leather Band Round Dial WWT-516709,soki-men-quartz-watch-with-date-leather-band-round-dial-p-160314.html,$3.93,$9.00 
11Pcs Car Motorcycle Bike Emergency Heavy Duty Tubeless Tire Puncture Repair Kit EDT-564808,11pcs-car-motorcycle-bike-emergency-heavy-duty-tubeless-tire-puncture-repair-kit-p-181246.html,$18.42,$33.15 
12V LED Digital Battery Alternator Tester Battery Tester Battery Level Monitor RTH-566986,12v-led-digital-battery-alternator-tester-battery-tester-battery-level-monitor-p-181757.html,$7.40,$8.88 
Frame Stand Bracket Exercise Tool Gym Workout Fitness Muscle Training Hot EDT-554810,frame-stand-bracket-exercise-tool-gym-workout-fitness-muscle-training-hot-p-176753.html,$26.04,$46.88 
Vehicle Car Electronic Clock Thermometer with Luminous RTH-520990,vehicle-car-electronic-clock-thermometer-with-luminous-p-162218.html,$11.04,$19.88 
500-Lumen Tactical Military Flashlight Set with Carrying Case HHIHE-568117,500-lumen-tactical-military-flashlight-set-with-carrying-case-p-181598.html,$8.79,$15.82 
Enhanced Edition Xiaomi SOOCAS X3+ Sonic Electric Toothbrush IPX7 HHI-525915,enhanced-edition-xiaomi-soocas-x3-sonic-electric-toothbrush-ipx7-p-164410.html,$45.69,$69.07 
Original Xiaomi Over-ear Headphone Relaxed Edition with Mic E-523616,original-xiaomi-over-ear-headphone-relaxed-edition-with-mic-p-163329.html,$50.67,$91.20 
20M Waterproof 200-LED Holiday Fairy String Lights EDT-555518,20m-waterproof-200-led-holiday-fairy-string-lights-p-177422.html,$11.29,$20.32 
LED String Light 10M Waterproof 100 LED Holiday String Lighting HHI-555614,led-string-light-10m-waterproof-100-led-holiday-string-lighting-p-177299.html,$5.04,$10.31 
S23 Smart Watch Outdoor Sports Time GPS Tracker Riding Mode IP67 E-525944,s23-smart-watch-outdoor-sports-time-gps-tracker-riding-mode-ip67-p-164392.html,$17.62,$116.40 
UV Protect Car Styling Front Window Sunshade Windshield Film Foldable RTH-534112,uv-protect-car-styling-front-window-sunshade-windshield-film-foldable-p-170467.html,$7.40,$9.16 
3PCS Color Thermal Paper Roll 57*30mm Photo Paper Clear Printing for PeriPage P6 HHIHE-583434,3pcs-color-thermal-paper-roll-5730mm-photo-paper-clear-printing-for-peripage-p6-p-201635.html,$4.23,$7.19 
Original xiaomi MIIIW RF 2.4GHz Wireless Office Keyboard Mouse Set 104 Keys ECA-583932,original-xiaomi-miiiw-rf-24ghz-wireless-office-keyboard-mouse-set-104-keys-p-201633.html,$36.43,$65.57 
Multifunctional Car Sun Visor Point Pocket Organizer Pouch Storage Bag ETATH-560983,multifunctional-car-sun-visor-point-pocket-organizer-pouch-storage-bag-p-178846.html,$6.37,$8.48 
TWS Bluetooth 5.0 Wireless Headset Earhook Earphones Sports with Chaging bay RTH-573704,tws-bluetooth-50-wireless-headset-earhook-earphones-sports-with-chaging-bay-p-182828.html,$14.04,$25.28 
Multi-function Gym Sports Equipment Thigh Master Arm Chest Waist Muscle Exercise HHI-558077,multi-function-gym-sports-equipment-thigh-master-arm-chest-waist-muscle-exercise-p-179971.html,$10.34,$18.61 
2 x 9 LED 12V Rear View Mirror Turn Signal Indicator Light Waterproof RTH-546645,2-x-9-led-12v-rear-view-mirror-turn-signal-indicator-light-waterproof-p-174742.html,$5.72,$10.29 
Car Rearview Mirror Protective Film Anti Fog Film Anti-glare Waterproof RTH-558889,car-rearview-mirror-protective-film-anti-fog-film-anti-glare-waterproof-p-177934.html,$4.56,$6.63 
8-Shaped Resistance Band Silicone Fitness Yoga Pull Rope HHI-558264,8-shaped-resistance-band-silicone-fitness-yoga-pull-rope-p-179748.html,$6.31,$8.90 
SG700 Satellite Navigation Foldable RC Drone Quadcopter – 0.3MP Cam TRC-559295,sg700-satellite-navigation-foldable-rc-drone-quadcopter-–-03mp-cam-p-180887.html,$37.12,$81.21 
Car Windshield Anti-fog Agent Rearview Mirror Rain-proof RTH-562478,car-windshield-anti-fog-agent-rearview-mirror-rain-proof-p-179349.html,$5.00,$8.99 
Portable Waterproof Outdoor Wireless Car Bluetooth Speaker for iPhone Xiaomi HHI-546264,portable-waterproof-outdoor-wireless-car-bluetooth-speaker-for-iphone-xiaomi-p-174555.html,$7.50,$14.26 
Dual Micro USB Charging Dock for PS4 Double Game Handle Dual Charge Dock Stand EVG-553272,dual-micro-usb-charging-dock-for-ps4-double-game-handle-dual-charge-dock-stand-p-176387.html,$8.24,$14.84 
Watch LED Digital Analog Quartz Wrist watches Men's S Shock Sports Wristwatches WWT-557863,watch-led-digital-analog-quartz-wrist-watches-mens-s-shock-sports-wristwatches-p-179887.html,$10.90,$19.62 
Stainless Steel taper 0~50mm Tyre Tire Veins Tread Depth Gauge Caliper HHI-542841,stainless-steel-taper-050mm-tyre-tire-veins-tread-depth-gauge-caliper-p-172505.html,$4.52,$10.84 
Throttle Mounted Motorcycle Cruise Assist Hand Rest Control Grips Handlebar SBK-542298,throttle-mounted-motorcycle-cruise-assist-hand-rest-control-grips-handlebar-p-172427.html,$3.42,$6.16 
Knee Brace Support for Arthritis ACL Running Basketball Meniscus Tear Sport STH-546483,knee-brace-support-for-arthritis-acl-running-basketball-meniscus-tear-sport-p-173938.html,$15.65,$20.35 
5m Car Door Anti-collision Trim Strip Door Scratch Protector Edge Guard Cover RTH-542161,5m-car-door-anti-collision-trim-strip-door-scratch-protector-edge-guard-cover-p-172348.html,$10.81,$19.46 
Alcohol Breath Tester Breathalyzer Mini Keychain Breath Analyzer EDT-550009,alcohol-breath-tester-breathalyzer-mini-keychain-breath-analyzer--p-175272.html,$4.22,$7.59 
Original Stereo earphone Metal handsfree sports Headset Heavy low EEP-556261,original-stereo-earphone-metal-handsfree-sports-headset-heavy-low-p-180158.html,$2.91,$5.81 
CoolChang 2.8'' Wired Bicycle Computer Rainproof Speedometer Odometer Stopwatch SBK-544203,coolchang-28-wired-bicycle-computer-rainproof-speedometer-odometer-stopwatch-p-173215.html,$12.01,$21.63 
Newest Mini Car Auto LCD Clip-on Digital Backlight Thermometer Clock Calendar RTH-544494,newest-mini-car-auto-lcd-clip-on-digital-backlight-thermometer-clock-calendar-p-173539.html,$3.50,$9.19 
E1 Bone Conduction Headphones Bluetooth 4.1 Wireless Bass HiFi Headsets EEP-545247,e1-bone-conduction-headphones-bluetooth-41-wireless-bass-hifi-headsets-p-173784.html,$11.05,$74.21 
Hotop 1 Pairs V Bike Brake Pads with Hex Nuts and Spacers V Bicycle Brake Blocks SBK-552443,hotop-1-pairs-v-bike-brake-pads-with-hex-nuts-and-spacers-v-bicycle-brake-blocks-p-176081.html,$4.56,$8.21 
JY011 2.4G Drone with WIFI FPV HD Camera Real time RC Quadcopter TRC-538495,jy011-24g-drone-with-wifi-fpv-hd-camera-real-time-rc-quadcopter-p-170543.html,$44.48,$99.53 
7 in 1 Multifunctional Key Holder EDC Tools STH-524885,7-in-1-multifunctional-key-holder-edc-tools-p-163944.html,$2.74,$3.65 
Bike Tire Bicycle Kit Patches Repair Glue RTH-554145,bike-tire-bicycle-kit-patches-repair-glue-p-176615.html,$3.21,$5.78 
Waterproof Solar Power LED Bicycle Lights Rechargeable Bike Rear Tail Lamp RTH-553275,waterproof-solar-power-led-bicycle-lights-rechargeable-bike-rear-tail-lamp-p-176445.html,$5.20,$8.98 
Lightweight Bike Brake Lever Aluminum Handle Cycling Brake Levers HHI-552918,lightweight-bike-brake-lever-aluminum-handle-cycling-brake-levers-p-176410.html,$6.92,$14.42 
Cool Bicycle Handlebar Grip Plug LED Light Riding Cycling Warning Flashlights SBK-553078,cool-bicycle-handlebar-grip-plug-led-light-riding-cycling-warning-flashlights-p-176406.html,$3.76,$6.77 
ESTRELLA 64GB Class 10 Micro SDXC Memory Card with Free Card Reader EFM-568310,estrella-64gb-class-10-micro-sdxc-memory-card-with-free-card-reader-p-181678.html,$6.76,$13.07 
