title,url,discount,actual
Transparent Anti Droplet Dust-proof Medical Face Shield Face Cover Mask HHI-581539,transparent-anti-droplet-dust-proof-medical-face-shield-face-cover-mask-p-200336.html,$2.81,$3.45 
100 LED Solar Light  Solar Lamp Powered Sunlight 3 Modes PIR Motion Sensor RTH-577401,100-led-solar-light-solar-lamp-powered-sunlight-3-modes-pir-motion-sensor-p-201640.html,$8.97,$14.79 
TWS F9 Bluetooth Earphone Touch Wireless Headphones 8D Stereo Sports Earbuds EEP-582910,tws-f9-bluetooth-earphone-touch-wireless-headphones-8d-stereo-sports-earbuds-p-200780.html,$11.99,$23.87 
Fsat Quick Charge 3.0 4.0 QC3.0 Fast Charging Tablet Wall Adapter HHITH-582324,fsat-quick-charge-30-40-qc30-fast-charging-tablet-wall-adapter-p-201049.html,$3.72,$6.70 
10 x Transparent Anti Droplet Dust-proof Medical Face Shield Face Cover Mask KB-581546,10-x-transparent-anti-droplet-dust-proof-medical-face-shield-face-cover-mask-p-200338.html,$13.74,$24.46 
Mini Airtight Sealer Machine for Plastic Bag - Assorted Color HLI-48626,mini-airtight-sealer-machine-for-plastic-bag-assorted-color-p-39392.html,$2.50,$5.82 
Wireless Headphones Bluetooth 5.0 Foldable Stereo Adjustable Earphones RTH-578691,wireless-headphones-bluetooth-50-foldable-stereo-adjustable-earphones-p-201646.html,$14.90,$21.61 
X96Q Android 10.0 TV Box Quad Core Allwinner H313 4K TV Box 2GB RAM 16GB ROM E-581778,x96q-android-100-tv-box-quad-core-allwinner-h313-4k-tv-box-2gb-ram-16gb-rom-p-201107.html,$30.95,$43.33 
Air Circulation Fan Mute Desktop Fans Atmosphere Ventilation Electric Fan HHI-581327,air-circulation-fan-mute-desktop-fans-atmosphere-ventilation-electric-fan-p-200717.html,$19.09,$34.36 
Wireless Earphones TWS Wireless Bluetooth 5.0 LED Display Waterproof Headphone EEP-580809,wireless-earphones-tws-wireless-bluetooth-50-led-display-waterproof-headphone-p-201417.html,$15.89,$17.48 
Silicone Nipple Cover Stickers Adhesive Bra Reusable Invisible Nipple Cover HHI-550767,silicone-nipple-cover-stickers-adhesive-bra-reusable-invisible-nipple-cover-p-175493.html,$1.98,$2.38 
Fashion N69 Smart Bracelet Sport Watch Blood Pressure Heart Rate Fitness Tracker E-544393,fashion-n69-smart-bracelet-sport-watch-blood-pressure-heart-rate-fitness-tracker-p-173351.html,$9.26,$58.22 
K08 Wireless Headphone Bluetooth5.0 Bone Conduction Headsets Wireless EEP-583532,k08-wireless-headphone-bluetooth50-bone-conduction-headsets-wireless-p-201440.html,$12.25,$22.66 
Fully USB Charging Automatic Foam Soap Dispenser Deep Cleaning HHI-581206,fully-usb-charging-automatic-foam-soap-dispenser-deep-cleaning-p-201087.html,$18.99,$22.79 
GM320 Infrared Thermometer Non-Contact Laser Gun IR Thermometer EDT-528767,gm320-infrared-thermometer-non-contact-laser-gun-ir-thermometer-p-165306.html,$16.86,$18.81 
F9 TWS Wireless Earphones Bluetooth 5.0 F9 TWS Bluetooth headphone EEP-583405,f9-tws-wireless-earphones-bluetooth-50-f9-tws-bluetooth-headphone-p-201446.html,$12.05,$21.70 
70mai Smart Dash Cam Pro English Voice Car DVR Camera GPS Auto Night Vision RCM-581275,70mai-smart-dash-cam-pro-english-voice-car-dvr-camera-gps-auto-night-vision-p-201053.html,$89.51,$107.42 
0.25W Intelligent Cabinet Sensor Lights HHI-546845,025w-intelligent-cabinet-sensor-lights-p-174242.html,$1.94,$5.25 
Outdoor Lights Solar Powered LED Wall Lamp Porch Lights Sensor Motion Sensor HSI-582757,outdoor-lights-solar-powered-led-wall-lamp-porch-lights-sensor-motion-sensor-p-201016.html,$8.11,$14.61 
100LED Solar Light Outdoor Solar Lamp PIR Motion Sensor Wall Light Waterproof HHIHE-582872,100led-solar-light-outdoor-solar-lamp-pir-motion-sensor-wall-light-waterproof-p-201245.html,$7.45,$10.05 
DUBERY Vintage Sunglasses Polarized Men's Sun Glasses For Men S-580871,dubery-vintage-sunglasses-polarized-mens-sun-glasses-for-men-p-200631.html,$6.28,$8.16 
3 in 1 Cable Nylon-Coating Fast Charging 8Pin Type-C Micro-USB EPA-530685,3-in-1-cable-nylon-coating-fast-charging-8pin-type-micro-usb-p-165980.html,$2.51,$4.34 
Xiaomi 3D Men Electric Shaver Razor Enchen BlackStone3 IPX7 Waterproof HHI-580937,xiaomi-3d-men-electric-shaver-razor-enchen-blackstone3-ipx7-waterproof-p-200797.html,$24.12,$28.94 
Silicone Stretch Lids Food Saver Covers Set – 6pcs HKI-550666,silicone-stretch-lids-food-saver-covers-set-–-6pcs-p-175450.html,$5.25,$6.83 
Xiaomi ENCHEN Sharp3S Men's Electric Hair Clipper USB Rechargeable Hair Trimmer HHIHE-581692,xiaomi-enchen-sharp3s-mens-electric-hair-clipper-usb-rechargeable-hair-trimmer-p-201119.html,$18.28,$27.42 
2PCS Automobile Electrostatic Sunshade Car Sunscreen Sticker RTH-391611,2pcs-automobile-electrostatic-sunshade-car-sunscreen-sticker--p-148929.html,$4.21,$7.74 
NAVIFORCE NF9161 Men's Watches Top Luxury Brand Analog Stainless Steel WWT-580848,naviforce-nf9161-mens-watches-top-luxury-brand-analog-stainless-steel-p-200814.html,$18.67,$33.61 
Camping Sleeping Pad Ultralight Waterproof self Inflating Sleeping Hiking HHI-582472,camping-sleeping-pad-ultralight-waterproof-self-inflating-sleeping-hiking-p-200843.html,$30.76,$39.99 
Xiaomi Turok Steinhardt TS Brand Polarized Stainless Mirror Lenses Sunglasses S-582106,xiaomi-turok-steinhardt-ts-brand-polarized-stainless-mirror-lenses-sunglasses-p-200936.html,$20.10,$34.16 
Men Electric Shaver Razor Beard Hair Clipper Trimmer Grooming Rechargeable Hair HHI-580827,men-electric-shaver-razor-beard-hair-clipper-trimmer-grooming-rechargeable-hair-p-201462.html,$24.12,$34.97 
1/2/4 Pair Magnetic Therapy Thermal Self-Heating Knee Pad Belt BBI-276865,124-pair-magnetic-therapy-thermal-self-heating-knee-pad-belt-p-118227.html,$3.61,$4.71 
X96Q Android 10.0 TV Box Quad Core Allwinner H313 4K TV Box 1GB RAM 8GB ROM E-581779,x96q-android-100-tv-box-quad-core-allwinner-h313-4k-tv-box-1gb-ram-8gb-rom-p-201108.html,$28.17,$39.44 
IP67 P8 Smart Watch Wristband Men Women Monitor Smartwatch Tracker For Phone E-580457,ip67-p8-smart-watch-wristband-men-women-monitor-smartwatch-tracker-for-phone-p-200649.html,$18.61,$36.53 
Wireless Bluetooth 5.0 Earphone Touch Control Headphones TWS Earbuds EEP-583087,wireless-bluetooth-50-earphone-touch-control-headphones-tws-earbuds-p-201005.html,$13.07,$23.52 
Micro SD TF Card 32GB Class Flash Memory Card for Smartphone Adapter EFM-582223,micro-sd-tf-card-32gb-class-flash-memory-card-for-smartphone-adapter-p-201054.html,$4.74,$8.54 
DUBERY Polarized Sunglasses Men's Driving Shades Male Sun Glasses S-580864,dubery-polarized-sunglasses-mens-driving-shades-male-sun-glasses-p-200630.html,$5.86,$15.11 
Smart Wireless Bluetooth Stereo Headset Headphone with MIC RTH-576453,smart-wireless-bluetooth-stereo-headset-headphone-with-mic-p-201645.html,$15.59,$24.95 
Hair Cutting Cloak Gown Umbrella Hair Salon Cape Hairdresser Haircut Bib Apron HKI-549496,hair-cutting-cloak-gown-umbrella-hair-salon-cape-hairdresser-haircut-bib-apron-p-175156.html,$3.69,$6.83 
Disposable Raincoat Adult Emergency Waterproof Poncho Rain Coat EVC-581041,disposable-raincoat-adult-emergency-waterproof-poncho-rain-coat-p-201458.html,$5.27,$9.48 
Android Robot Shaped Micro USB to USB 2.0 Host OTG Adapter ECACR-487310,android-robot-shaped-micro-usb-to-usb-20-host-otg-adapter-p-157418.html,$1.41,$2.71 
1 Pair of Silicone Magnetic Losing Weight Toe Rings HBI-13397,1-pair-of-silicone-magnetic-losing-weight-toe-rings-p-12727.html,$1.06,$3.24 
Xiaomi Mijia iHealth Thermometer LED Non Contact Digital Infrared Forehead Body RTH-575855,xiaomi-mijia-ihealth-thermometer-led-non-contact-digital-infrared-forehead-body-p-200865.html,$28.41,$36.94 
90*30cm Ice Towel Instant Cooling Towel Heat Relief Reusable Chill Cool Towel HHI-549301,9030cm-ice-towel-instant-cooling-towel-heat-relief-reusable-chill-cool-towel-p-174936.html,$2.18,$2.61 
Smart Bracelet Watch Fitness Bracelet Pedometer Heart Rate Monitor Waterproof E-583049,smart-bracelet-watch-fitness-bracelet-pedometer-heart-rate-monitor-waterproof-p-200803.html,$11.37,$14.77 
1/2/5/10 pcs Mini Reusable Silicone Baking Cups Muffin Cups Truffle Cups HKI-544853,12510-pcs-mini-reusable-silicone-baking-cups-muffin-cups-truffle-cups-p-173471.html,$0.97,$2.71 
T10 Bluetooth Headsets Wireless Earbuds 5.0 TWS Earphone EEP-581913,t10-bluetooth-headsets-wireless-earbuds-50-tws-earphone-p-200802.html,$13.28,$25.54 
E27 G80 Led Light Bulb 3D Decoration Bulb Holiday Lights Decorative Light Lamp HLT-552162,e27-g80-led-light-bulb-3d-decoration-bulb-holiday-lights-decorative-light-lamp-p-176113.html,$4.85,$10.46 
Light Controlled Square LED Wall Night Lamp Bedroom Night Light HLT-506114,light-controlled-square-led-wall-night-lamp-bedroom-night-light-p-158312.html,$2.30,$5.26 
DC 12V 45cm 45-SMD 1210 LED Flexible Waterproof Car Strip Light RLT-274929,dc-12v-45cm-45-smd-1210-led-flexible-waterproof-car-strip-light-p-118388.html,$1.27,$2.29 
Neoprene Short Beach Socks Diving Socks Non-Slip Antiskid Scuba Dive Boots SGD-548443,neoprene-short-beach-socks-diving-socks-non-slip-antiskid-scuba-dive-boots-p-174657.html,$3.39,$3.78 
Strong Light LED Flashlight Multifunctional Outdoor Lighting USB Charging HHI-581187,strong-light-led-flashlight-multifunctional-outdoor-lighting-usb-charging-p-201407.html,$10.26,$14.88 
Bicycle Shorts Cycling Underwear Thick Silicone Cushion Cycling Biker Shorts SBK-583204,bicycle-shorts-cycling-underwear-thick-silicone-cushion-cycling-biker-shorts-p-200974.html,$10.46,$18.82 
12V Motorcycle & Car Automatic Intelligent Battery Charger Pulse Repair Charger RTH-581710,12v-motorcycle-car-automatic-intelligent-battery-charger-pulse-repair-charger-p-200716.html,$23.01,$27.61 
Cordless Bluetooth Earphone With Bluetooth Speaker Function TWS Earphones EEP-581927,cordless-bluetooth-earphone-with-bluetooth-speaker-function-tws-earphones-p-200711.html,$17.96,$32.33 
USB Hub 3.0 USB Splitter Multiple Port Hab Splitters Use Power Adapter HHIHE-582904,usb-hub-30-usb-splitter-multiple-port-hab-splitters-use-power-adapter-p-200985.html,$8.80,$15.83 
XIAOMI MIJIA Microhoo Mini Air Conditioner Fan Personal Portable USB Air Cooler HHIHE-582526,xiaomi-mijia-microhoo-mini-air-conditioner-fan-personal-portable-usb-air-cooler-p-200948.html,$60.33,$72.40 
Compression Socks for Man Woman STH-563907,compression-socks-for-man-woman-p-180225.html,$2.41,$6.41 
Fashion Intelligent Thermometer Temperature Measuring Ring Stainless Steel HHI-566390,fashion-intelligent-thermometer-temperature-measuring-ring-stainless-steel-p-181553.html,$1.43,$1.97 
Pitch Adjustable Ultrasonic Whistle for Pet - Small Size IPA-46471,pitch-adjustable-ultrasonic-whistle-for-pet-small-size-p-37263.html,$1.53,$2.74 
Adjustable M3-M8 T-Handle Ratchet Tap Wrench Machinist Tool EDT-582922,adjustable-m3-m8-t-handle-ratchet-tap-wrench-machinist-tool-p-201018.html,$8.15,$14.66 
Autumn Winter Leather Baseball Cap Men Women Gorras Planas Snapback Hat RTH-576721,autumn-winter-leather-baseball-cap-men-women-gorras-planas-snapback-hat-p-201587.html,$8.48,$10.60 
10Pcs LED Light Balloon for Wedding and Party Decoration SBK-522961,10pcs-led-light-balloon-for-wedding-and-party-decoration-p-163018.html,$3.13,$3.97 
6pcs Reusable Silicone Food Cover Stretch Wrap Cover Food Fresh HKI-582634,6pcs-reusable-silicone-food-cover-stretch-wrap-cover-food-fresh-p-200991.html,$4.49,$8.09 
Multifunction USB 2.0 M2/ TF Card Reader w/ Lanyard CCR-85173,multifunction-usb-20-m2-tf-card-reader-w-lanyard-p-57252.html,,
Xiaomi Weiyuan Portable Mini Handheld Leafless Fan Silent Creative Design Fan HHIHE-583169,xiaomi-weiyuan-portable-mini-handheld-leafless-fan-silent-creative-design-fan-p-200953.html,$11.66,$17.49 
Car Paint Scratches Repair Pen Brush Waterproof Paint Marker Pen Car Maintain RTH-571469,car-paint-scratches-repair-pen-brush-waterproof-paint-marker-pen-car-maintain-p-182211.html,$1.68,$4.84 
Kangaroo Brand Leather Messenger Bag Man Handbag Chest Bag RTH-577738,kangaroo-brand-leather-messenger-bag-man-handbag-chest-bag-p-200744.html,$17.71,$21.25 
5 LED Water Resistant USB Rechargeable LED Bike Tail Light RTH-555898,5-led-water-resistant-usb-rechargeable-led-bike-tail-light-p-177336.html,$2.93,$5.26 
T6 Rainbow Backlight Illuminated Multimedia Wired Gaming Keyboard and Mouse Set HHIHE-564544,t6-rainbow-backlight-illuminated-multimedia-wired-gaming-keyboard-and-mouse-set-p-180911.html,$31.05,$37.25 
Ultra HD Sport Camera DVR DV Camcorder Waterproof Helmet Camcorder EVC-582222,ultra-hd-sport-camera-dvr-dv-camcorder-waterproof-helmet-camcorder-p-201037.html,$24.06,$43.31 
10 pcs Snore Stopper Silicone Nose Clip Sleeping Device Nasal Dilators KB-531795,10-pcs-snore-stopper-silicone-nose-clip-sleeping-device-nasal-dilators-p-166469.html,$5.85,$10.53 
1/2 pcs Mini Camera SQ11 Night Vision FOV140 1080P DV Video Recorder ECM-533708,12-pcs-mini-camera-sq11-night-vision-fov140-1080p-dv-video-recorder-p-168604.html,$7.57,$12.11 
Detachable Baseball Protective Clear Face mask Cap Anti-Splash Hat S-581830,detachable-baseball-protective-clear-face-mask-cap-anti-splash-hat-p-200362.html,$3.08,$3.71 
Metal Watch Band Link Pin Remover Disassembly Tool NLC-558037,metal-watch-band-link-pin-remover-disassembly-tool-p-180196.html,$3.13,$5.15 
"1Pair Memory Foam Insoles, Breathable Sports Insole for Shoe Shock Absorption WWT-548414",1pair-memory-foam-insoles-breathable-sports-insole-for-shoe-shock-absorption-p-174655.html,$2.81,$5.76 
2.4GHz 1600dpi Wireless Optical Mouse Mice CMS-11833-C3,24ghz-1600dpi-wireless-optical-mouse-mice-p-168444.html,$3.56,$6.83 
Electric Grinding Foot Control Foot Care Skin Remover Polish Repair HHI-524331,electric-grinding-foot-control-foot-care-skin-remover-polish-repair-p-163664.html,$8.17,$12.97 
Xiaomi 4 Ports USB3.0 Hub with Stand-by Power Supply Interface USB Hub EDT-583798,xiaomi-4-ports-usb30-hub-with-stand-by-power-supply-interface-usb-hub-p-201630.html,$11.79,$16.51 
Water Guns Summer Children Beach Bathing Drift Water Toy Color Random HHIHE-553595,water-guns-summer-children-beach-bathing-drift-water-toy-color-random-p-176414.html,$4.56,$8.21 
UV Light USB Mosquito Killer Lamp Electric Fly Mosquito Trap Anti Mosquito Bug HHI-582254,uv-light-usb-mosquito-killer-lamp-electric-fly-mosquito-trap-anti-mosquito-bug-p-200840.html,$8.76,$15.76 
Sunglasses Bluetooth 5.0 Earphone Headset X8S Headphones Smart Glasses RTH-576447,sunglasses-bluetooth-50-earphone-headset-x8s-headphones-smart-glasses-p-201644.html,$10.62,$18.05 
GM321 Non-contact Infrared Thermometer -50° to 380° EDT-568819,gm321-non-contact-infrared-thermometer-50°-to-380°-p-181807.html,$24.71,$29.65 
Handmade Wicker Woven Purse Handbag Circle Boho Bag DTH-566592,handmade-wicker-woven-purse-handbag-circle-boho-bag-p-182362.html,$22.38,$40.29 
Elough E04 2 in 1 Type C+Micro USB Magnetic USB Charging&Date Transmission Cable EPACB-545637,elough-e04-2-in-1-type-cmicro-usb-magnetic-usb-chargingdate-transmission-cable-p-173846.html,$3.34,$9.30 
Ultra HD 4K Touch Screen Action Camera Wifi cam 4K Sport Camera Remote Control EVC-582219,ultra-hd-4k-touch-screen-action-camera-wifi-cam-4k-sport-camera-remote-control-p-201036.html,$34.47,$62.04 
T10 USB Wireless Bluetooth 5.0 Receiver Transmitters Audio Adapter Dongle TV PC RTH-572200,t10-usb-wireless-bluetooth-50-receiver-transmitters-audio-adapter-dongle-tv-pc-p-182427.html,$4.09,$6.79 
S03 Smart Watch Waterproof Activity Tracker Smart Band Bracelet E-582866,s03-smart-watch-waterproof-activity-tracker-smart-band-bracelet-p-200781.html,$11.88,$23.87 
Q66 Wireless V5.0 HD Stereo Headphone Sports Waterproof Headset EEP-578008,q66-wireless-v50-hd-stereo-headphone-sports-waterproof-headset-p-200792.html,$16.63,$19.96 
Metal Cigarette Case with Windproof Butane Jet Flame Torch Lighter HLI-5383,metal-cigarette-case-with-windproof-butane-jet-flame-torch-lighter-p-4798.html,$4.87,$5.14 
Baellerry Men Wallets PU Leather Solid Luxury Slim Short Credit Card Holder HHI-582256,baellerry-men-wallets-pu-leather-solid-luxury-slim-short-credit-card-holder-p-200737.html,$3.70,$20.36 
Universal 6'' Phone Lanyard Necklace & Wrist Strap Card Bag Holder w Lanyard HHITH-543753,universal-6-phone-lanyard-necklace-wrist-strap-card-bag-holder-w-lanyard-p-172964.html,$2.06,$3.07 
3.5mm Stereo Woven Fiber Cloth Line Headset EDT-556403,35mm-stereo-woven-fiber-cloth-line-headset-p-178024.html,$1.57,$4.88 
Men Sport Watches BOAMIGO Brand  Quartz Watches Analog Digital Watch RTH-572656,men-sport-watches-boamigo-brand-quartz-watches-analog-digital-watch-p-201531.html,$14.43,$28.13 
JM-8106 38 in 1 Precision Screwdriver Set Disassemble Repair Tools Kit PC Phone RTH-571815,jm-8106-38-in-1-precision-screwdriver-set-disassemble-repair-tools-kit-pc-phone-p-182697.html,$11.55,$20.78 
Outdoor Portable Key Style Pocket Folding Knife Mini Key Ring Knife S-523854,outdoor-portable-key-style-pocket-folding-knife-mini-key-ring-knife-p-163464.html,$1.91,$3.44 
Men Digital Watches Waterproof Mens Sport LED Men Electronic watches RTH-578709,men-digital-watches-waterproof-mens-sport-led-men-electronic-watches-p-201456.html,$5.31,$6.90 
Unisex Hot Sport Waist Trainer Neoprene Belt Tummy Slimming Shaper Power Belt BBI-546293,unisex-hot-sport-waist-trainer-neoprene-belt-tummy-slimming-shaper-power-belt-p-173776.html,$6.34,$9.52 
Magnetic Therapy Thermal Self-Heating Waist Pad Belt Waist Brace HSI-25926,magnetic-therapy-thermal-self-heating-waist-pad-belt-waist-brace-p-21743.html,$6.45,$11.61 
Anti Snoring Belt Snore Stopper Chin Jaw Strap Sleep Improving Belt DTH-501605,anti-snoring-belt-snore-stopper-chin-jaw-strap-sleep-improving-belt-p-157945.html,$2.13,$3.83 
2-in-1 Multipurpose Keyboard Groove Brush Set EDT-555031,2-in-1-multipurpose-keyboard-groove-brush-set-p-176868.html,$1.72,$2.53 
Car Tire Repair Kit Vacuum Auto Tire Repair Gun Vacuum Tire Repair Tool RTH-575405,car-tire-repair-kit-vacuum-auto-tire-repair-gun-vacuum-tire-repair-tool-p-201466.html,$17.81,$32.05 
8mm Intelligent Thermometer Temperature Measuring Ring HHI-566384,8mm-intelligent-thermometer-temperature-measuring-ring-p-181149.html,$1.49,$6.61 
Funlife 12pcs / set Green Crystal Three-dimensional Wall Stickers Mirror HHI-562368,funlife-12pcs-set-green-crystal-three-dimensional-wall-stickers-mirror-p-179148.html,$2.27,$6.83 
Waterproof Reusable Rain Shoes Covers Rubber Slip-Resistant Rain Boot Overshoes S-557900,waterproof-reusable-rain-shoes-covers-rubber-slip-resistant-rain-boot-overshoes-p-179875.html,$3.63,$6.83 
Car Repair Accessories Body Compound Paste Set Scratch Abrasive Paint Care HHI-572557,car-repair-accessories-body-compound-paste-set-scratch-abrasive-paint-care-p-200842.html,$2.51,$4.52 
Double Zippers Design Multi-functional Storage Bag HHI-115510,double-zippers-design-multi-functional-storage-bag-p-68145.html,$4.27,$4.51 
2pcs DC 12V 31mm Festoon 3W 6-5630 SMD LED Car Reading Lamp RLT-304676,2pcs-dc-12v-31mm-festoon-3w-6-5630-smd-led-car-reading-lamp-p-127115.html,$2.36,$4.25 
Universal Bike LED Flashlight Torch Mount Holder 360° Rotation Cycling Clip SBK-544750,universal-bike-led-flashlight-torch-mount-holder-360°-rotation-cycling-clip-p-173387.html,$3.80,$6.13 
F2 Magnifier Eyes Protection Display Folding 3D Screen Mobile Phone Amplifier RTH-571755,f2-magnifier-eyes-protection-display-folding-3d-screen-mobile-phone-amplifier-p-201442.html,$5.29,$10.06 
1/2 pcs CREE XM-L T6 1-LED 3800LM 5 Modes Zoom LED Flashlight STH-485135,12-pcs-cree-xm-l-t6-1-led-3800lm-5-modes-zoom-led-flashlight-p-156642.html,$7.52,$13.30 
Wool Soft Car Washing Gloves Automotive Car Cleaning Brush Tool Washer Care RTH-572409,wool-soft-car-washing-gloves-automotive-car-cleaning-brush-tool-washer-care-p-182392.html,$3.38,$6.08 
WLISTH S959 Men's Business Quartz Steel Band Sports Waterproof Watch WWT-580836,wlisth-s959-mens-business-quartz-steel-band-sports-waterproof-watch-p-200674.html,$12.46,$25.72 
Unsex Knit Beanie Hat Winter Hat Beanies Cap DHA-564148,unsex-knit-beanie-hat-winter-hat-beanies-cap-p-180299.html,$2.91,$5.04 
Men PU Leather Long Clutch Wallet Business Men Cards Phone Holder Purse HHI-581828,men-pu-leather-long-clutch-wallet-business-men-cards-phone-holder-purse-p-201124.html,$12.51,$18.77 
2in1 Electric Mosquito Swatter Dispeller /Mosquito Killer Lamp USB Charging HHIHE-582871,2in1-electric-mosquito-swatter-dispeller-mosquito-killer-lamp-usb-charging-p-200982.html,$27.59,$49.67 
ROCKBROS Polarized Sports Men Sunglasses Road Cycling Glasses SBK-567209,rockbros-polarized-sports-men-sunglasses-road-cycling-glasses-p-181558.html,$14.74,$17.69 
Fascia Gun Muscle Massage Gun Fitness Decompose Lactic Acid Relief Pain Relax HHI-581942,fascia-gun-muscle-massage-gun-fitness-decompose-lactic-acid-relief-pain-relax-p-200720.html,$48.71,$87.67 
2PCs Wristbands Sport Sweatband Hand Band Sweat Wrist Support Brace Wrist Guards S-549945,2pcs-wristbands-sport-sweatband-hand-band-sweat-wrist-support-brace-wrist-guards-p-175242.html,$2.05,$3.70 
Magnetic Tip Two Way Cross Flat Head Screwdriver NLC-558210,magnetic-tip-two-way-cross-flat-head-screwdriver-p-178209.html,$4.52,$8.13 
Waterproof Children Kids Boy Watches Digital LED Quartz Alarm Watch RTH-577972,waterproof-children-kids-boy-watches-digital-led-quartz-alarm-watch-p-201558.html,$4.37,$6.99 
Shorts Women Sexy Push Up Fitness Sportswear Striped Underwear HHI-580700,shorts-women-sexy-push-up-fitness-sportswear-striped-underwear-p-200894.html,$7.02,$9.13 
10 x Protective Goggles Fit Over Glasse Prevention of Coronavirus KB-581884,10-x-protective-goggles-fit-over-glasse-prevention-of-coronavirus-p-200365.html,$11.17,$18.24 
X5 Bluetooth 5.0+3.0+2.4G Wireless Three Mode Mute Rechargeable Gaming Mouse ECAMS-579447,x5-bluetooth-503024g-wireless-three-mode-mute-rechargeable-gaming-mouse-p-201481.html,$11.87,$20.17 
2 x Super Bright 33-LED SMD White Car Light RLT-554928,2-x-super-bright-33-led-smd-white-car-light-p-176782.html,$2.81,$6.57 
7.87” Silicone Folding Kitchen Strainer – Small Size HHI-548566,787”-silicone-folding-kitchen-strainer-–-small-size-p-174604.html,$4.71,$8.48 
TWS4 Bluetooth 5.0 Wireless Headphones Touch Mini In-Ear Buds w Charging Bin EEP-582907,tws4-bluetooth-50-wireless-headphones-touch-mini-in-ear-buds-w-charging-bin-p-200741.html,$10.01,$19.46 
Sun Shape Silicone Fried Egg Mold Ring Cooking Tool HKI-403964,sun-shape-silicone-fried-egg-mold-ring-cooking-tool-p-151695.html,$1.41,$1.54 
Youpin Showsee Electric Hair Clipper Trimmer Ceramic Cutter Hair Rechargeable HHIHE-583926,youpin-showsee-electric-hair-clipper-trimmer-ceramic-cutter-hair-rechargeable-p-201637.html,$20.23,$30.34 
F600 Wireless Bluetooth Headset Stereo Sports Headphone EEP-562007,f600-wireless-bluetooth-headset-stereo-sports-headphone-p-179300.html,$11.27,$20.29 
Wired Gaming Headphone Deep Bass Game Earphone Computer Headphones RTH-580150,wired-gaming-headphone-deep-bass-game-earphone-computer-headphones-p-201441.html,$13.46,$22.88 
Women Urinal Travel Outdoor Camping Soft Silicone Urination Device HHI-549224,women-urinal-travel-outdoor-camping-soft-silicone-urination-device-p-175142.html,$1.90,$3.43 
Liquid Luminous Coating Fluorescent Body/Face Paint Luminous Acrylic Paints S-549334,liquid-luminous-coating-fluorescent-bodyface-paint-luminous-acrylic-paints-p-175143.html,$2.21,$3.98 
Wireless Mouse Vertical Mouse Ergonomic Optical 2400 DPI 6 Buttons Mause ECAMS-582851,wireless-mouse-vertical-mouse-ergonomic-optical-2400-dpi-6-buttons-mause-p-200748.html,$12.49,$22.47 
Electric Mini Hand Drill Rotary Metal Wood Engraver Grinder Polishing Machine EDT-579380,electric-mini-hand-drill-rotary-metal-wood-engraver-grinder-polishing-machine-p-201404.html,$27.80,$40.31 
T6+COB Tactical Military LED Flashlight Torch Zoomable 5-Mode Lamp EDT-559334,t6cob-tactical-military-led-flashlight-torch-zoomable-5-mode-lamp-p-179287.html,$9.41,$16.94 
Zippered Nylon Mesh Clothes Washing Bag HHI-561078,zippered-nylon-mesh-clothes-washing-bag-p-178670.html,$2.15,$2.99 
1/2 pcs Standard 1M Magnetic Charge Cable + Detachable Micro USB Metal Plug EPACB-487297,12-pcs-standard-1m-magnetic-charge-cable-detachable-micro-usb-metal-plug-p-156704.html,$2.87,$6.26 
T19 Transmitter and Receiver Call 4 in 1 TV Computer Dual Transmitter ECA-583893,t19-transmitter-and-receiver-call-4-in-1-tv-computer-dual-transmitter-p-201636.html,$9.75,$12.67 
Mini503 Bluetooth 4.0 Headset Sport Wireless  Music Stereo Earphones RTH-579417,mini503-bluetooth-40-headset-sport-wireless-music-stereo-earphones-p-201439.html,$10.49,$11.53 
Freewolf X11 1600DPI 2.4GHz Wireless Mute Rechargeable Mouse LED Backlit Optical EDT-563573,freewolf-x11-1600dpi-24ghz-wireless-mute-rechargeable-mouse-led-backlit-optical-p-179770.html,$10.46,$13.60 
LEELIFE Seductive Deep V Neck Babydolls Nightdress for Ladies NUL-147002,leelife-seductive-deep-v-neck-babydolls-nightdress-for-ladies-p-79715.html,$4.80,$6.23 
14 in 1 Multifunctional EDC Tools Card Pocket Size NLC-524794,14-in-1-multifunctional-edc-tools-card-pocket-size-p-163873.html,$1.89,$3.70 
USB2.0 802.11 b/ g/ n 150Mbps Wireless Adapter with Antenna CNP-150792,usb20-80211-b-g-n-150mbps-wireless-adapter-with-antenna-p-81238.html,$4.82,$6.11 
360° Rotate Kitchen Adjustable Water-saving Faucet HHI-551104,360°-rotate-kitchen-adjustable-water-saving-faucet-p-175572.html,$2.80,$3.63 
2x Multicoloured LED Bicycle Bike Valve Light Bike Wheel Light Tire SBK-553784,2x-multicoloured-led-bicycle-bike-valve-light-bike-wheel-light-tire-p-176576.html,$1.77,$3.45 
Aluminium Foil Tape Adhesive Sealing Tape Thermal Resist Duct Repairs Tool RTH-573533,aluminium-foil-tape-adhesive-sealing-tape-thermal-resist-duct-repairs-tool-p-182724.html,$6.04,$10.87 
30 x 30cm Car Care Wax Polishing Towel Car Washing Towel RTH-562195,30-x-30cm-car-care-wax-polishing-towel-car-washing-towel-p-179092.html,$3.36,$6.04 
