title,url,discount,actual
Waterproof Drift Diving Swimming Bag Underwater Dry Shoulder Waist Pack Bag S-571004,waterproof-drift-diving-swimming-bag-underwater-dry-shoulder-waist-pack-bag-p-182832.html,$4.42,$7.96 
G2000 Gaming Headsets with Mic for PC HHI-564730,g2000-gaming-headsets-with-mic-for-pc-p-180265.html,$25.79,$46.42 
Mini I8X Wireless Bluetooth V4.2 In-Ear Headphone for iPhone 6 - Right Earbuds EEP-543285-C3,mini-i8x-wireless-bluetooth-v42-in-ear-headphone-for-iphone-6-right-earbuds-p-176816.html,$6.87,$12.37 
Multi-function Outdoor Survival Bracelet Emergency Rope Compass Whistle Knife RTH-572589,multi-function-outdoor-survival-bracelet-emergency-rope-compass-whistle-knife-p-182825.html,$2.72,$4.43 
LED Solar Hand Crank Dynamo Solar Powered Rechargeable LED Camping Flashlight EDT-564861,led-solar-hand-crank-dynamo-solar-powered-rechargeable-led-camping-flashlight-p-181311.html,$7.50,$13.50 
IPEGA PG-9023 Bluetooth Telescopic Controller Game Handle Wireless Gamepad EVG-545534,ipega-pg-9023-bluetooth-telescopic-controller-game-handle-wireless-gamepad-p-173626.html,$28.52,$51.34 
YAGE YG-336C Waterproof Rechargeable Zooming LED Flashlight 3-Mode RTH-566973,yage-yg-336c-waterproof-rechargeable-zooming-led-flashlight-3-mode-p-181740.html,$12.85,$23.12 
7 LED T6+4XPE Bright Headlight Focusing Camping Lamp USB Charging Lamp EDT-559335,7-led-t64xpe-bright-headlight-focusing-camping-lamp-usb-charging-lamp--p-179286.html,$16.03,$28.85 
Hand Cranking Solar Powered Rechargeable Quick Snap Clip Flashlight HHI-563775,hand-cranking-solar-powered-rechargeable-quick-snap-clip-flashlight-p-179563.html,$8.04,$14.48 
Cartoon Luminous Switch Adornment Switch Case Switch Sticker Switch Cover HKI-549586,cartoon-luminous-switch-adornment-switch-case-switch-sticker-switch-cover-p-175197.html,$2.85,$5.13 
10pcs Confetti Balloons 12 Inches Large Balloons For Party Wedding Decorations HHI-549375,10pcs-confetti-balloons-12-inches-large-balloons-for-party-wedding-decorations-p-175147.html,$3.35,$6.04 
Magnetic LED Flashlight Car Emergency Light Maintenance Repair Lamp HLT-526692,magnetic-led-flashlight-car-emergency-light-maintenance-repair-lamp-p-164895.html,$3.76,$6.78 
A07 32 LED Colorful Rechargeable Cycling Wheel Spoke Light 32-pattern SBK-527727,a07-32-led-colorful-rechargeable-cycling-wheel-spoke-light-32-pattern-p-165042.html,$6.68,$12.03 
[3A Fast Charging] 2 in 1 Keychain & Cable Micro-USB Cable SBK-527690,3a-fast-charging-2-in-1-keychain-cable-micro-usb-cable-p-164940.html,$2.38,$4.29 
[3A Super Fast] Original Xiaomi ZMI Type-c to Type-c Cable Data Sync E-527790,3a-super-fast-original-xiaomi-zmi-type-to-type-cable-data-sync-p-164931.html,$2.60,$10.48 
Original Samsung Galaxy S6 S7 Edge Note 5 Headset Earphones Earbuds with Mic EEP-548059,original-samsung-galaxy-s6-s7-edge-note-5-headset-earphones-earbuds-with-mic-p-174170.html,$2.08,$5.29 
Lovely Car Anti-slip Non Slip Mat Pad for Key Cellphone RTH-546082,lovely-car-anti-slip-non-slip-mat-pad-for-key-cellphone-p-173887.html,$6.24,$11.23 
USB Work Light Car Outdoor Traveling Emergency Lights w 4-color Light HHI-527055,usb-work-light-car-outdoor-traveling-emergency-lights-w-4-color-light-p-165018.html,$17.67,$31.80 
5PCS Multifunctional Carabiner Clip-On Clamp Key Chain Hook S-526654,5pcs-multifunctional-carabiner-clip-on-clamp-key-chain-hook-p-164634.html,$1.66,$2.98 
Squishy Simulation Peach Slow Rising Squeeze Vent Finger Toy Stress Relief TDS-530271,squishy-simulation-peach-slow-rising-squeeze-vent-finger-toy-stress-relief-p-165916.html,$3.99,$7.18 
Multifunctional Pendant DIY Begleri EDC Titanium Alloy Finger Toy TDS-529383,multifunctional-pendant-diy-begleri-edc-titanium-alloy-finger-toy-p-165713.html,$2.33,$4.19 
DIY Begleri Stainless Steel EDC Finger Toy for ADD ADHD Reduce Stress STH-529382,diy-begleri-stainless-steel-edc-finger-toy-for-add-adhd-reduce-stress-p-165712.html,$2.73,$4.91 
1/2 pcs Magnetic Therapy Posture Corrector Brace Shoulder Back Support Belt HHI-531351,12-pcs-magnetic-therapy-posture-corrector-brace-shoulder-back-support-belt-p-166392.html,$8.79,$15.94 
YWXLight 100 -240V 2A EU / US Plug Led Strip Power Driver Adapter f Strip Light HLT-533197,ywxlight-100-240v-2a-eu-us-plug-led-strip-power-driver-adapter-f-strip-light-p-168600.html,$3.71,$9.00 
"X11 Bluetooth Smartwatch Phone Android 5.1 512M/4G 1.54"" Screen E-529522",x11-bluetooth-smartwatch-phone-android-51-512m4g-154-screen-p-165673.html,$25.18,$132.63 
Free Wolf  6 Button LED Optical Gaming Mouse Mechanical Macro Programmable ETATH-558901,free-wolf-6-button-led-optical-gaming-mouse-mechanical-macro-programmable-p-179989.html,$9.67,$17.40 
Water Guns Summer Children Beach Bathing Drift Water Toy Color Random TDS-553376,water-guns-summer-children-beach-bathing-drift-water-toy-color-random-p-179987.html,$4.56,$8.21 
New Triangle Kids Car Seat Safety Belt Fixer Child Neck Protection HHI-549192,new-triangle-kids-car-seat-safety-belt-fixer-child-neck-protection-p-175125.html,$2.34,$4.21 
Car Visor Organizer Pouch Glasses Holder Clip HHI-549191,car-visor-organizer-pouch-glasses-holder-clip-p-175119.html,$5.66,$10.91 
Digital Multi-function Food Kitchen Scale Stainless Steel Platform EDT-557514,digital-multi-function-food-kitchen-scale-stainless-steel-platform-p-180024.html,$13.17,$23.70 
2pcs Bag Sealed Clip Sealing Clamp for 10cm Bag HKI-549591,2pcs-bag-sealed-clip-sealing-clamp-for-10cm-bag-p-175167.html,$2.21,$3.98 
1A 5V Micro USB TP4056 Lithium Battery Power Charger Board Module EDT-549963,1a-5v-micro-usb-tp4056-lithium-battery-power-charger-board-module-p-175233.html,$2.44,$4.38 
Baseus Mini USB Rechargeable Fan Clip-on Fan 360° Rotation Portable Desktop Fan HHIHE-563891,baseus-mini-usb-rechargeable-fan-clip-on-fan-360°-rotation-portable-desktop-fan-p-180101.html,$16.86,$30.35 
Storage Bag Kits Reel-type Toolkit Multifunctional Storage Electrical Package EDT-558057,storage-bag-kits-reel-type-toolkit-multifunctional-storage-electrical-package-p-179973.html,$9.59,$17.26 
Portable Rechargeable Desktop Handheld Nature Wind Mini USB Fans HHI-549376,portable-rechargeable-desktop-handheld-nature-wind-mini-usb-fans-p-175198.html,$12.89,$23.19 
1.5 Meter Soft and Retractable Tape Body Height Tailor Sewing Measuring Tape HHI-549544,15-meter-soft-and-retractable-tape-body-height-tailor-sewing-measuring-tape-p-175122.html,$1.95,$3.51 
Speed ​​Jump Rope Professional Jump Rope For Boxing Fitness Skip Training HHI-553957,speed-​​jump-rope-professional-jump-rope-for-boxing-fitness-skip-training-p-180086.html,$9.57,$17.22 
Crrju Fashion Mens Watches Top Brand Luxury Quartz Watch Men WWT-555984,crrju-fashion-mens-watches-top-brand-luxury-quartz-watch-men-p-180049.html,$13.30,$28.90 
28KW Household Smart Power Electricity Saving Box Electricity Saving Box HHIHE-548462-T3,28kw-household-smart-power-electricity-saving-box-electricity-saving-box-p-176383.html,$5.63,$9.01 
Thickening Kneepad Extreme Knee Pad Elbow Brace Support Lap Knee Protector S-549869,thickening-kneepad-extreme-knee-pad-elbow-brace-support-lap-knee-protector-p-175209.html,$6.87,$12.36 
180*8 CM Elastic Weight Lifting Knee Bandages Powerlifting Leg Compression HHI-549847,1808-cm-elastic-weight-lifting-knee-bandages-powerlifting-leg-compression-p-175208.html,$8.68,$15.62 
SanDisk CZ73 64GB USB3.0 Flash Memory Drives U-disk EUD-541727,sandisk-cz73-64gb-usb30-flash-memory-drives-u-disk-p-171974.html,$8.32,$28.10 
Pet Cone E-Collar f Cat Plastic Elizabeth Protective Collar Anti-Bite Neck Cover HPI-541160-NO4,pet-cone-e-collar-f-cat-plastic-elizabeth-protective-collar-anti-bite-neck-cover-p-172003.html,$2.91,$6.22 
Q18 Smart Sports Wristband 1.54 Inch Color Screen Heart Rate Monitor E-562233,q18-smart-sports-wristband-154-inch-color-screen-heart-rate-monitor-p-179906.html,$31.40,$56.52 
KKTICK F2 Waterproof 1.1 Inch Luminous Display Bluetooth Smartwatch E-562166,kktick-f2-waterproof-11-inch-luminous-display-bluetooth-smartwatch-p-179905.html,$26.04,$46.88 
ESTRELLA  16G USB2.0 High Speed Mini Flash Drive Waterproof USB EUD-555516,estrella-16g-usb20-high-speed-mini-flash-drive-waterproof-usb-p-176842.html,$5.20,$9.37 
Cute Big Headband Ears BBI-563835,cute-big-headband-ears-p-180215.html,$2.16,$3.88 
3.5mm In-Ear Sport Running Portable Piston Earphone Headset with Microphone EEP-548038,35mm-in-ear-sport-running-portable-piston-earphone-headset-with-microphone-p-174803.html,$5.03,$8.54 
Latest Xiaomi Mi In-Ear Headphones with MIC E-548558,latest-xiaomi-mi-in-ear-headphones-with-mic-p-174744.html,$11.25,$21.79 
Universal Mobile Phone Holder Long Arm Lazy Mount Bracket 360 Degree Flexible RTH-547971,universal-mobile-phone-holder-long-arm-lazy-mount-bracket-360-degree-flexible-p-174788.html,$17.72,$31.89 
DIY Desk Phone Holder Lazy Stent Flexible Neck Mount Bracket RTH-547967,diy-desk-phone-holder-lazy-stent-flexible-neck-mount-bracket-p-174783.html,$7.91,$14.25 
Baseus E06 Dogz Bluetooth Speaker Portable Mini Bluetooth Speaker HHITH-548281,baseus-e06-dogz-bluetooth-speaker-portable-mini-bluetooth-speaker-p-174767.html,$15.87,$28.57 
11 in 1 Mini Pocket Bicycle Repair Tool Kits w Chain Breaker/ Hex Keys/ Torx T25 NLC-544114-C33,11-in-1-mini-pocket-bicycle-repair-tool-kits-w-chain-breaker-hex-keys-torx-t25-p-173969.html,$5.81,$6.83 
LED Watch Silica Gel Men Sports Digital LED Wrist Watches HHI-556326,led-watch-silica-gel-men-sports-digital-led-wrist-watches-p-177572.html,$2.22,$3.99 
5V 2A Wall Charger Universal White USB Plug Power Adapter for iPhone Samsung EPACG-545272,5v-2a-wall-charger-universal-white-usb-plug-power-adapter-for-iphone-samsung-p-173831.html,$2.23,$7.43 
Double Chin Skin Face Bandage Belt BBI-564821,double-chin-skin-face-bandage-belt-p-180257.html,$3.30,$5.94 
Temperature Control 4 Colors Change Handheld Shower Head HHI-547652,temperature-control-4-colors-change-handheld-shower-head-p-174297.html,$13.90,$18.06 
Mosquito Repellent Bracelet with 2 Refill Pellets Repellent Band Mosquito Killer HHI-548255,mosquito-repellent-bracelet-with-2-refill-pellets-repellent-band-mosquito-killer-p-174282.html,$3.52,$4.57 
Home Automatic Toothpaste Dispenser Toothbrush Holder Toothpaste Squeezers HHI-546338,home-automatic-toothpaste-dispenser-toothbrush-holder-toothpaste-squeezers-p-174044.html,$8.37,$10.88 
LEMFO LES2 Smart Watch Android 5.1 1GB + 16GB Heart Rate Monitor GPS WIFI Watch E-541742-C35,lemfo-les2-smart-watch-android-51-1gb-16gb-heart-rate-monitor-gps-wifi-watch-p-177098.html,$106.99,$162.43 
M9 Color Screen IP67 Waterproof Silicone Strap Smart Watch Blood Pressure E-552639-C129,m9-color-screen-ip67-waterproof-silicone-strap-smart-watch-blood-pressure-p-176776.html,$18.81,$19.77 
LEMFO LEM7 Android 7.0 LTE 4G Smart Watch Phone 1GB + 16GB Memory with Camera E-554991-C35,lemfo-lem7-android-70-lte-4g-smart-watch-phone-1gb-16gb-memory-with-camera-p-176998.html,$136.24,$194.51 
3W 550-650LM 3-LED Ceiling Light Warm White & Natural White HLT-520812,3w-550-650lm-3-led-ceiling-light-warm-white-natural-white-p-162094.html,$4.23,$8.78 
YWXLight Spot Light MR16 (GU5.3) 12V 9W 600-810LM 1-LED COB Bulbs HLT-516534,ywxlight-spot-light-mr16-gu53-12v-9w-600-810lm-1-led-cob-bulbs-p-160470.html,$2.30,$8.25 
White Modern 8 Shape LED Display Alarm Clock 24 or 12 Hour Digital 3D Wall Clock EBR-544903,white-modern-8-shape-led-display-alarm-clock-24-or-12-hour-digital-3d-wall-clock-p-173552.html,$14.58,$26.24 
Heavy Duty Cargo Net Organizer Storage Mesh Stretchable Car Truck Net Organizer RTH-541289,heavy-duty-cargo-net-organizer-storage-mesh-stretchable-car-truck-net-organizer-p-171978.html,$7.34,$15.70 
Essential Oil Car Diffuser Adjustable Car Air Freshener - Rosemary Smell RTH-540390-C35,essential-oil-car-diffuser-adjustable-car-air-freshener-rosemary-smell-p-171753.html,$2.91,$9.45 
Car Sunshade Board Park Tag Phone Number High-speed IC Card Clip Holder RTH-545132,car-sunshade-board-park-tag-phone-number-high-speed-ic-card-clip-holder-p-173550.html,$4.19,$7.55 
280ml Tile Reform Epoxy Grouts Sealant Waterproof Mouldproof Gaps Filling Agents HHI-546332,280ml-tile-reform-epoxy-grouts-sealant-waterproof-mouldproof-gaps-filling-agents-p-173793.html,$10.54,$13.70 
1Pcs Anti-static Key Chain Body Static Eliminator Electrostatic Canceller f/ Car RKC-546092,1pcs-anti-static-key-chain-body-static-eliminator-electrostatic-canceller-f-car-p-173614.html,$2.71,$4.87 
Broadlink RM Mini3 Smart Home Automation WiFi+IR Intelligent Remote Controller ECA-545597,broadlink-rm-mini3-smart-home-automation-wifiir-intelligent-remote-controller-p-173610.html,$17.59,$22.86 
Luminous Explosion Hooks Fishing Setup Monster Tackle Carp Silver Bait Hooks SFS-545711,luminous-explosion-hooks-fishing-setup-monster-tackle-carp-silver-bait-hooks-p-173644.html,$2.63,$3.95 
QCY T1C Mini Bluetooth Earphones with Mic and Charging Box EEP-565174,qcy-t1c-mini-bluetooth-earphones-with-mic-and-charging-box-p-180819.html,$24.70,$32.10 
Mini Infrared Induction Helicopter Hand Induction Flying Aircraft for Kids TDS-546066,mini-infrared-induction-helicopter-hand-induction-flying-aircraft-for-kids-p-173638.html,$10.66,$14.55 
2.4GHz Wireless Optical Gaming Mouse for PC DPI Adjustable ECAMS-496120-C14,24ghz-wireless-optical-gaming-mouse-for-pc-dpi-adjustable-p-168441.html,$4.42,$6.26 
Funny Cute Extrusion Pea Bean Soybean Edamame Stress Relieve Toy Keychain Beans TTH-539439,funny-cute-extrusion-pea-bean-soybean-edamame-stress-relieve-toy-keychain-beans-p-171025.html,$1.89,$2.46 
100ML Fluffy Slime DIY Mud Plasticine Soft Foam Slime Stress Relief Toys TTH-546126,100ml-fluffy-slime-diy-mud-plasticine-soft-foam-slime-stress-relief-toys-p-173637.html,$5.46,$7.10 
LED Wheel Valve Stem Tire Motion Neon Light Lamp for Bike Bicycle Car Motorcycle RTH-545231,led-wheel-valve-stem-tire-motion-neon-light-lamp-for-bike-bicycle-car-motorcycle-p-173488.html,$2.09,$2.72 
4 in 1 Interior Car Decorative Light 3-LED Blue Atmosphere Lights Foot Lamps RTH-545232,4-in-1-interior-car-decorative-light-3-led-blue-atmosphere-lights-foot-lamps-p-173717.html,$5.31,$8.44 
DDPai mini Wi-Fi Full HD 1080P Dashcam 140 Degree Wide Angle Night-vision RCM-545447,ddpai-mini-wi-fi-full-hd-1080p-dashcam-140-degree-wide-angle-night-vision-p-173589.html,$58.82,$76.46 
Baby On Board Sign of Baby in Car Auto Safety Warning Reflective Car Sticker RST-545054,baby-on-board-sign-of-baby-in-car-auto-safety-warning-reflective-car-sticker-p-173452.html,$2.35,$3.05 
Universal Quick Charge 3.0 Car Charger 5.2A Phone Charger 3 USB Car Charger RCG-547642,universal-quick-charge-30-car-charger-52a-phone-charger-3-usb-car-charger-p-174547.html,$5.68,$9.58 
Q1 Pro IP67 MTK6737 Quad-core 1GB 8GB WiFi Heart Rate Android 6.0 4G Smart Watch E-544454,q1-pro-ip67-mtk6737-quad-core-1gb-8gb-wifi-heart-rate-android-60-4g-smart-watch-p-173323.html,$55.35,$103.55 
2018 New Fitness Tracker MX Smart Bracelet Heart Rate Monitor Waterproof Watch E-544359,2018-new-fitness-tracker-mx-smart-bracelet-heart-rate-monitor-waterproof-watch-p-173299.html,$8.62,$41.98 
Wake-Up LED Light Sunrise Simulation Alarm Clock FM Radio Night Lamp HLT-525716,wake-up-led-light-sunrise-simulation-alarm-clock-fm-radio-night-lamp-p-164207.html,$18.42,$43.60 
YWXLight G9 AC110V AC220V 5W 430-450LM SMD 2835 LED Peanut Lamp HLT-522535,ywxlight-g9-ac110v-ac220v-5w-430-450lm-smd-2835-led-peanut-lamp-p-162857.html,$1.68,$3.02 
YWXLIGHT G4 LED Bulb 12 SMD 2835 Corn Light Spotlight HLT-522529,ywxlight-g4-led-bulb-12-smd-2835-corn-light-spotlight-p-162839.html,$1.34,$1.89 
GK-490 104 Keys 1.5m USB Wired Mechanical Hand Feel Keyboard EGC-547553,gk-490-104-keys-15m-usb-wired-mechanical-hand-feel-keyboard-p-174176.html,$38.12,$49.55 
Universal Temporary Car Parking Card Magnetic Phone Number Card Plate for Car RTH-547415,universal-temporary-car-parking-card-magnetic-phone-number-card-plate-for-car-p-174551.html,$4.43,$5.76 
Portable Car Ashtray with LED Light Cigarette Cigar Ash Tray Auto Accessories RTH-546577,portable-car-ashtray-with-led-light-cigarette-cigar-ash-tray-auto-accessories-p-174522.html,$6.79,$8.08 
Silicone Car Key Remote Cover Case for Volkswagen RTH-546069,silicone-car-key-remote-cover-case-for-volkswagen-p-173914.html,$2.39,$3.11 
Red Wine Bottle Stoppers Stainless Steel with Inner Rubber Seal Keep Wine Fresh HHI-545827,red-wine-bottle-stoppers-stainless-steel-with-inner-rubber-seal-keep-wine-fresh-p-173847.html,$3.87,$8.08 
Mini Unicorn Inflatable Cup Holder Drink Floating Party Beverage Boats Pool Toys HHI-548753,mini-unicorn-inflatable-cup-holder-drink-floating-party-beverage-boats-pool-toys-p-174626.html,$2.61,$3.39 
8 inch Multifunctional Y Shape Universal Spanner Home Car Office Repair Tool HHI-573638,8-inch-multifunctional-y-shape-universal-spanner-home-car-office-repair-tool-p-182812.html,$11.10,$14.43 
SNAKE BIT 360 Screwdriver 6 in 1 Mulitfunctional Rotating Screwdriver Tools HHI-546149,snake-bit-360-screwdriver-6-in-1-mulitfunctional-rotating-screwdriver-tools-p-173871.html,$8.88,$11.54 
20cm 8-inch Length Spring Loaded Triangle Folding Shelf Support Bracket HHI-547003,20cm-8-inch-length-spring-loaded-triangle-folding-shelf-support-bracket-p-174301.html,$13.43,$17.46 
Automatic Tap Electric Water Bottle Pump USB Rechargeable 1.2L 1.8L HHI-548580,automatic-tap-electric-water-bottle-pump-usb-rechargeable-12l-18l-p-174600.html,$34.75,$45.18 
Outdoor Portable Adjustable Sliver Alloy Support Stand Fishing Rod Rest Holders SFS-548133,outdoor-portable-adjustable-sliver-alloy-support-stand-fishing-rod-rest-holders-p-174504.html,$4.60,$5.98 
Adult Games Finger Endurance Trainer Exerciser Sex Toys NSX-548191,adult-games-finger-endurance-trainer-exerciser-sex-toys-p-174503.html,$3.34,$4.34 
Yoga Half Ball Physical Fitness Appliance Exercise Balance Ball 4 Colors STH-547477,yoga-half-ball-physical-fitness-appliance-exercise-balance-ball-4-colors-p-174308.html,$8.70,$11.31 
Double Lacrosse Ball Peanut Massage Ball for Thoracic Spine STH-548021,double-lacrosse-ball-peanut-massage-ball-for-thoracic-spine-p-174236.html,$9.49,$12.34 
Massage Lacrosse Ball for Myofascial Release Trigger Point Therapy Muscle Knots STH-548015,massage-lacrosse-ball-for-myofascial-release-trigger-point-therapy-muscle-knots-p-174235.html,$5.70,$7.41 
Mini Yoga Pilates Ball 25cm Stability Exercise Training Ball STH-547491,mini-yoga-pilates-ball-25cm-stability-exercise-training-ball-p-174173.html,$4.26,$5.54 
V3 USB Computer Optoelectronic Wired Game Mouse ELT-566159,v3-usb-computer-optoelectronic-wired-game-mouse-p-181133.html,$6.94,$9.03 
4pcs 12V Motorcycle Turn Signal Indicator Light 12 LED Blue Amber Lamp RTH-546343,4pcs-12v-motorcycle-turn-signal-indicator-light-12-led-blue-amber-lamp-p-174135.html,$13.16,$17.11 
Oxford Zippered Multi-functional Business Bag DBA-548575,oxford-zippered-multi-functional-business-bag-p-174613.html,$11.72,$14.34 
Children's Educational Toddler Toys Photo Camera Kids Mini Digital Toy Camera TDS-566084,childrens-educational-toddler-toys-photo-camera-kids-mini-digital-toy-camera-p-181428.html,$37.81,$49.15 
6-Egg Learning Education Toys Puzzle Smart Egg Baby Learning Toys Tool TDS-547097,6-egg-learning-education-toys-puzzle-smart-egg-baby-learning-toys-tool-p-174134.html,$5.78,$7.52 
2 PCS Car Solar Protection 63.5*39cm Side Window Block Sunshade Cover Screen RTH-547412,2-pcs-car-solar-protection-63539cm-side-window-block-sunshade-cover-screen-p-174558.html,$6.96,$9.05 
Portable Multi-function Car Heater Fan Defroster Defogger RTH-546150,portable-multi-function-car-heater-fan-defroster-defogger-p-173897.html,$14.19,$29.20 
Unisex Adjustable Waist Belt Fitness Sweat-absorbent Breathable Body Shaping BBI-547619,unisex-adjustable-waist-belt-fitness-sweat-absorbent-breathable-body-shaping-p-174263.html,$8.28,$10.77 
5 in 1 Electric Facial Washing Brush Cleaning Machine BBI-547853,5-in-1-electric-facial-washing-brush-cleaning-machine-p-174262.html,$6.71,$9.87 
6pcs/ bag Anti-slip Strips Shower Stickers Safety Strips for Bathtubs Showers HHI-549335,6pcs-bag-anti-slip-strips-shower-stickers-safety-strips-for-bathtubs-showers-p-174900.html,$5.74,$8.02 
QCY T1C Mini Bluetooth 5.0 Music Earphones with Power Case EEP-560772,qcy-t1c-mini-bluetooth-50-music-earphones-with-power-case-p-178910.html,$22.43,$29.16 
Mini Bluetooth 4.2 Speaker Small War Drum Music Wireless Speakers RTH-567079,mini-bluetooth-42-speaker-small-war-drum-music-wireless-speakers-p-181809.html,$32.02,$41.63 
USB C Hub Adapter Type C 4 in 1 Multi Port OTG Combo Charger Hub EPA-548630,usb-hub-adapter-type-4-in-1-multi-port-otg-combo-charger-hub-p-174876.html,$2.41,$8.58 
Car Storage Bag Backseat Holder Pockets Auto Accessories for kid RTH-548999,car-storage-bag-backseat-holder-pockets-auto-accessories-for-kid-p-174867.html,$6.07,$8.98 
Waterproof Oxford Cloth Shoes Bag for Travel STH-548833,waterproof-oxford-cloth-shoes-bag-for-travel-p-174808.html,$4.35,$5.65 
10g Fishing Lures Hard Bait with Treble Hook SFS-548937,10g-fishing-lures-hard-bait-with-treble-hook-p-174909.html,$1.78,$2.33 
Weight Lifting Wrist Bracers Adjustable Wristband Elastic Wrist Wraps Bandages S-546989,weight-lifting-wrist-bracers-adjustable-wristband-elastic-wrist-wraps-bandages-p-174789.html,$5.83,$7.58 
Q5 Smart Watch Bluetooth Heart Rate Pedometer 8G 3G Calls WIFI GPS Wristwatch E-527501,q5-smart-watch-bluetooth-heart-rate-pedometer-8g-3g-calls-wifi-gps-wristwatch-p-165127.html,$41.13,$142.44 
150*200CM Outdoor Beach Mat Picnic Blanket Quick Sand SCH-548600,150200cm-outdoor-beach-mat-picnic-blanket-quick-sand-p-174869.html,$13.36,$17.37 
Squishiy Kawaii Scented Soft Ice-cream Slow Rising Stress Relief Toy HHI-549420,squishiy-kawaii-scented-soft-ice-cream-slow-rising-stress-relief-toy-p-174939.html,$5.33,$6.40 
YWXLIGHT 5W Mini COB+Q5 LED Flashlight 4 Modes Portable Camp Torch with Clip HLT-543552,ywxlight-5w-mini-cobq5-led-flashlight-4-modes-portable-camp-torch-with-clip-p-173144.html,$3.90,$5.15 
Car Charger Power Adapter with Dual USB Output EDT-565139,car-charger-power-adapter-with-dual-usb-output-p-181015.html,$3.62,$5.82 
2 in 1 Wireless Bluetooth 4.0 Receiver Audio Adapter Music Transmitter ECA-533206,2-in-1-wireless-bluetooth-40-receiver-audio-adapter-music-transmitter-p-167947.html,$6.21,$14.91 
Teeth Whitening Pen Tooth Gel Whitener Stain Eraser Remove Instant HHI-549310,teeth-whitening-pen-tooth-gel-whitener-stain-eraser-remove-instant-p-174970.html,$1.69,$2.03 
One Pair of Compression Foot Sleeves STH-548667,one-pair-of-compression-foot-sleeves-p-174832.html,$2.86,$3.44 
Xiaomi Doctor Bei Kids Toothbrush E-548561,xiaomi-doctor-bei-kids-toothbrush-p-174740.html,$7.67,$9.97 
T-Shape Insoles High Heel Shoes Pad Super Soft Insole Non Slip HHI-548417,t-shape-insoles-high-heel-shoes-pad-super-soft-insole-non-slip--p-174656.html,$2.58,$3.10 
Hardware Tool Bag Electrical Maintenance Household Thick Oxford Shoulder Bag EDT-566531,hardware-tool-bag-electrical-maintenance-household-thick-oxford-shoulder-bag-p-181353.html,$22.80,$27.36 
European Spring/Summer Infantile Cross Headband S-564478,european-springsummer-infantile-cross-headband-p-181066.html,$2.37,$4.27 
Universal Super Sticky Car Mount 360 Degree Dashboard Holder for Cell Phone RTH-562509,universal-super-sticky-car-mount-360-degree-dashboard-holder-for-cell-phone-p-180493.html,$5.03,$6.37 
0.1g LCD Electronic Measuring Spoon with Scale EDT-564450,01g-lcd-electronic-measuring-spoon-with-scale-p-180894.html,$8.68,$11.28 
24-in-1 Tire Type Precision Toolbox for Home Repairs EDT-561632,24-in-1-tire-type-precision-toolbox-for-home-repairs-p-180850.html,$22.90,$29.76 
276 Pc Rotary Tool Accessory Set RTH-562931,276-pc-rotary-tool-accessory-set-p-180389.html,$35.63,$42.75 
YWXLIGHT 85-265V E27 25W 2500LM 108-LED SMD 5730 LED Corn Bulb Warm White HLT-530241,ywxlight-85-265v-e27-25w-2500lm-108-led-smd-5730-led-corn-bulb-warm-white-p-166070.html,$9.46,$12.26 
Electric Mosquito Insect Killer Lamp Led Photocatalyst Fly Trap Bug Killer Lamp HHI-560559,electric-mosquito-insect-killer-lamp-led-photocatalyst-fly-trap-bug-killer-lamp-p-180791.html,$16.85,$20.22 
Resistance Bands Set Loop Circle for Legs and Butt. HHI-561744,resistance-bands-set-loop-circle-for-legs-and-butt-p-180852.html,$6.03,$8.34 
Sport Watches Mens Watches Top Brand Luxury Military DJA-564085,sport-watches-mens-watches-top-brand-luxury-military-p-180931.html,$9.09,$11.81 
Hair Brush-3D Bomb Curl Brush Styling Salon Round Hair Curling Curler Comb Tool HHI-549117,hair-brush-3d-bomb-curl-brush-styling-salon-round-hair-curling-curler-comb-tool-p-175139.html,$4.81,$5.77 
20 in 1 Mobile Phone Repair Tools Kit Set for iPhone 7 6S 6 Samsung Phone HHI-538116,20-in-1-mobile-phone-repair-tools-kit-set-for-iphone-7-6s-6-samsung-phone-p-170986.html,$4.92,$8.22 
1 Pair Men Women Arm Sleeves Summer Sun UV Protection S-567108,1-pair-men-women-arm-sleeves-summer-sun-uv-protection-p-181799.html,$2.54,$3.05 
Summer Sandals Men Leather Classic Roman Sandals Slipper Rubber Flip Flops DSH-568764,summer-sandals-men-leather-classic-roman-sandals-slipper-rubber-flip-flops-p-181751.html,$31.85,$41.41 
Pet Training Clicker Big Button Set with Wrist Strap - Assorted Color HPI-532225,pet-training-clicker-big-button-set-with-wrist-strap-assorted-color-p-166583.html,$2.08,$2.44 
1pcs 60CM Car Trunk Fixed Belts RTH-564779,1pcs-60cm-car-trunk-fixed-belts-p-181251.html,$3.19,$3.85 
Foam Rectangle Shape Gym Fitness Exercise Workout Training Yoga Block HHI-565934,foam-rectangle-shape-gym-fitness-exercise-workout-training-yoga-block-p-181442.html,$5.87,$7.04 
5/6PC Broken Damaged Screwdriver Extractor Set RTH-568003,56pc-broken-damaged-screwdriver-extractor-set-p-181577.html,$7.71,$9.25 
